"150 V St NW Unit VL06,","Washington, DC 20001","$479,900",2,2,869,"Welcome to Parker Flats, a fabulous boutique condo building in the heart of Bloomingdale. Ideally located between U Street NW and V Street NW, this meticulously maintained 2BR/2BA unit with GARAGE PARKING and its own entrance has it all! Features include hardwood floors and carpet throughout, oversized windows, and a bright open floor plan. The combo kitchen/living/dining area provides the perfect open space for cooking gourmet meals and snacks while also socializing and entertaining guests. Beautiful maple kitchen cabinets, a suite of stainless steel appliances, fabulous granite countertops, and large island that can be used as a breakfast bar and serving space. The spacious Owner's suite is complete carpet and attached private bath. A second bedroom with roomy walk-in closet. Another full-sized bath and stacked washer/dryer. Finally, the underground garage parking seals the deal on this opportunity as one you cannot miss! Amenities include fitness center, enclosed courtyard, and building security. Parker Flats is the perfect place to call home. Live in the heart of vibrant Bloomingdale, within walking distance to the Shaw-Howard Metro Station. Enjoy plenty of nearby award winning restaurants/bars and much, much more right outside your door! Make your showing appointment online today!",Active,15 days,Condo,$529/month,2006,LEDROIT PARK,,DCDC2021624,"$479,900",$552,"$477,848",Beaux Arts,38.9179149,-77.0142991,Rory Obletz,Washington Redfin Agent,https://www.redfin.com/DC/Washington/150-V-St-NW-20001/unit-VL06/home/12530670,Langley Elementary School,4,290
"516 M St NW #3,","Washington, DC 20001","$1,200,000",3,3,"1,600","Stunning new condo project! This large, 1600sf, 3bd/3ba penthouse unit is located in the ultra convenient Shaw neighborhood and features and exceptional bright and open floor plan; 7"" wide plank engineered wood floors; gourmet kitchen with waterfall island; 2 decks; simply amazing bathrooms; custom lighting details throughout; master w/ walk in closet. This condo is special!",Active,16 days,Condo,$263/month,2021,OLD CITY II,"1,327 Sq. Ft.",DCDC2021050,"$1,200,000",$750,"$1,189,989",Condo/Unit,38.9054366,-77.0196162,Rory Obletz,Washington Redfin Agent,https://www.redfin.com/DC/Washington/516-M-St-NW-20001/unit-3/home/177213230,Walker-Jones Education Campus,3,384
"57 N St NW Ph 412,","Washington, DC 20001","$714,900",2,1.5,981,"PENTHOUSE RESIDENCE 412 is a luminous and gracious South-facing Jr 2BR/1.5BA Duplex with TWO PRIVATE OUTDOOR SPACES and is located in the Historic Stable that looks out to the charming N Street Row Homes. Inside, you will find a modern galley kitchen that opens to the living and dining area. Accompanied by the private rooftop terrace, a guaranteed extension of living space. Custom Shades will convey and are clearly appreciated in the master bedroom upstairs housing 18' ceilings. 1 Garaged Parking space is optional for purchase at $52,250 (compatible for EV). Bike storage is available for residents in garage and Zone 5 street parking is available for residents. * We welcome you to Chapman Stables , a collection of 114 modern/historic luxury condominiums in the highly desirable Truxton Circle. Chapman is located at the intersection of 1st and N Street in NW DC, in the same building as the local favorite, REPUBLIC CANTINA RESTAURANT. Chapman's modern design reflects the revitalization of the former horse stable, with its unique and custom designs, has given residences custom built-in kitchens and mill work throughout accent walls. Expansive windows and Canadian frameless cabinetry. The amenity-rich, pet-friendly building, with two ELEVATORS, also boasts a common roof terrace with stunning city Capitol and Monument views accompanied by RESTORATION HARDWARE furniture in all common areas.",Active,10 days,Condo,$573/month,2018,OLD CITY II,,DCDC2022206,"$714,900",$729,"$713,885",Contemporary,38.9074434,-77.0111884,Rory Obletz,Washington Redfin Agent,https://www.redfin.com/DC/Washington/57-N-St-NW-20001/unit-412/home/162411918,Walker-Jones Education Campus,3,384
"516 M St NW #2,","Washington, DC 20001","$660,000",2,2,915,"Stunning new condo project! This gorgeous 2bd/2ba condo is located in the ultra convenient Shaw neighborhood and features and exceptional bright and open floor plan; 7"" wide plank engineered wood floors; gourmet kitchen with waterfall island; simply amazing bathrooms; rear patio. This condo is special!",Active,16 days,Condo,$197/month,2021,OLD CITY II,"1,327 Sq. Ft.",DCDC2021060,"$660,000",$721,"$658,564",Condo/Unit,38.9054366,-77.0196162,Rory Obletz,Washington Redfin Agent,https://www.redfin.com/DC/Washington/516-M-St-NW-20001/unit-2/home/177213252,Walker-Jones Education Campus,3,384
"1119 V St NW,","Washington, DC 20009","$1,035,000",2,1,—,"An amazing location a 13+. A former restaurant WITH REAR PATIO FOR OUT DOOR DINNING in the booming U St. corridor. Looking for a developer with vision. One block from the U ST CORRIDOR, TWO BLOCK FROM TWO METRO STATIONS. All the glitter you want and need is here. Two bedroom and a kitchen upstairs. you can build up and extend out in the back. walkable scale off the chart. you can covert it in two condominium if you plan to add two stories. COULD BE A BAR OR FAST FOOD OR COULD BE OFFICE 0R OTHER RETAIL. YOU MAKE IT WHAT YOU NEED.",Active,6 days,Townhouse,,1920,OLD CITY II,"1,140 Sq. Ft.",DCDC2022440,"$1,035,000",,"$1,032,382",Colonial,38.9182792,-77.0278412,Rory Obletz,Washington Redfin Agent,https://www.redfin.com/DC/Washington/1119-V-St-NW-20009/home/81828311,Garrison Elementary School,9,277
"929 Florida Ave NW #7008,","Washington, DC 20001","$749,000",2,2,"1,176","Situated in the vibrant U Street Corridor, an incredible modern masterpiece awaits with an incomparable blend of industrial and relaxed elegant styling. The 2BR/2BA contemporary condo wows with unobstructed views of downtown Washington from your own private terrace! Wide-plank, white oak hardwood flooring, BoConcepts cabinetry and lighting, and floor-to-ceiling windows frame the loft-style layout. The gourmet kitchen features a commercial appliance package including Liebherr refrigeration and dual-fuel cooking, Carrara marble waterfall countertops, a custom backsplash, and sleek white thermofoil cabinetry. The primary bedroom suite is bright and spacious with a wall of windows overlooking downtown Washington. Pass through the walk-in closet to the en suite bath with a floating dual vanity and soaking tub. Stairs lead to the second bedroom/office hideaway with a built-in murphy bed and desk. A second full bath completes this must-see home. One underground parking space and additional storage convey. Owners at The Floridian have access to a stellar rooftop terrace with private dining and lounging areas offering sweeping city views. The location is a dream for weekend wanderers with Whole Foods on the next block and all that U Street has to offer two blocks away. Weekend plans are set - dine at one of the many nearby crave-worthy restaurants then catch a show at the 9:30 Club. U Street Metro is moments away for convenient commutes around downtown.",Active,21 days,Condo,$680/month,2006,COLUMBIA HEIGHTS,,DCDC2020594,"$749,000",$637,"$744,946",Contemporary,38.918709,-77.0241962,Rory Obletz,Washington Redfin Agent,https://www.redfin.com/DC/Washington/929-Florida-Ave-NW-20001/unit-7008/home/21644030,Cleveland Elementary School,5,304
"910 M St NW #307,","Washington, DC 20001","$499,900",1,1,788,"OPEN HOUSE: SAT (12/4); 1-3 PM. You'll love this spacious 1BR/1BA condo with RESERVED GARAGE PARKING in amenity-rich Whitman Condominium! Unit #307 is a spacious condo with tall ceilings, hardwood floors, and private balcony. The open floor plan has an area for a large living space, dining area and home office space. The kitchen features stainless appliances, granite counters, large kitchen island, and ample cabinet space. Relax in the spacious bedroom with its own private balcony, double closets and access to the updated bathroom! The dual-entry bathroom has nice lighting, mirror, and vanity. W/ D in the unit and reserved garage parking included! The building is pet-friendly and has AMENITIES GALORE including a large rooftop deck with sweeping city and monument views, rooftop pool with multiple seating areas and grills, fitness center with plenty of equipment, party and billiards room, and 24/7 concierge service! The Whitman is perfectly located just one block to Metro and Convention Center and just moments to some of DC's most popular fine dining restaurants, cafes, coffee shops, and grocery stores!",Active,21 days,Condo,$601/month,2006,OLD CITY II,,DCDC2017674,"$499,900",$634,"$502,062",Contemporary,38.9054055,-77.0246698,Rory Obletz,Washington Redfin Agent,https://www.redfin.com/DC/Washington/910-M-St-NW-20001/unit-307/home/23056805,Thomson Elementary School,6,331
"18 Channing St NW #1,","Washington, DC 20001","$775,000",3,2.5,"1,500","Perfect condo in LeDroit Park! Luxury appointments throughout. This amazing 2 Level, 3 Bedroom, 2.5 bath residence features modern design, with a chefâs kitchen with island, quartz countertops, and Bertazzoni appliances! Thinking of taking the party outside? Just off the kitchen is an oversized deck, perfect for entertaining outdoors. The ownerâs suite level features floor to ceiling windows, walk in closet, an incredible bathroom with separate shower, free standing tub, and dual sink vanity. This building is pet-friendly, fully wired for cable, internet, and ethernet, has a low monthly fee, and off-street parking. Check out the plans underway for McMillan park to see the amazing park, Harris Teeter, and retail being built across the street! Square Footage Estimated and taxes not yet assessed.",Active,22 days,Condo,$224/month,1908,LEDROIT PARK,,DCDC2020700,"$775,000",$517,"$768,531",Traditional,38.9222253,-77.0098367,Rory Obletz,Washington Redfin Agent,https://www.redfin.com/DC/Washington/18-Channing-St-NW-20001/unit-1/home/176677367,Langley Elementary School,4,290
"18 Channing St NW #2,","Washington, DC 20001","$999,000",3,3.5,"1,800","Perfect condo in LeDroit Park! Floor to ceiling windows create amazing sun filled spaces, perfect for entertaining. This stunning 3 Level, 3 Bedroom, 3.5 bath residence features modern design, with a chefâs kitchen with island, quartz countertops, Bertazzoni appliances, and a wet bar off the living room! The ownerâs suite level features floor to ceiling windows, twin closets, a large bathroom with separate shower, tub, and water closet. The landing is complimented by a second wet bar with wine fridge and opens onto the roof deck. This building is pet-friendly, fully wired for cable, internet, and ethernet, has a low fee, and off-street parking. Check out the plans underway for McMillan park to see the amazing park, Harris Teeter, and retail being built across the street! Square footage estimated and taxes not yet assessed.",Active,22 days,Condo,$224/month,1908,LEDROIT PARK,,DCDC2020702,"$999,000",$555,"$987,501",Traditional,38.9222253,-77.0098367,Rory Obletz,Washington Redfin Agent,https://www.redfin.com/DC/Washington/18-Channing-St-NW-20001/unit-2/home/176677371,Langley Elementary School,4,290
"619 Florida Ave NW,","Washington, DC 20001","$1,799,000",7,5.5,"4,270","History, location and fabulous rental opportunities all combine in this classic multi-family LeDroit Park property. The entry level of the primary house showcases a roomy living room, separate dining room and an office/den. The island kitchen with its stainless steel appliances, granite counters and dramatic range hood is ready for those holiday meals or for just making morning coffee. Upstairs finds 5 bedrooms and 4 newly-renovated full baths perfect for family living or welcoming those anxiously awaited out-of-town guests. New hardwood floors, the original mantles of the three fireplaces and the cozy rear patio with a fire pit further enhance the charm of this splendid home. Moreover, the property include 2 rental possibilities. The basement of the main house is a perfect studio rental unit, and the 2 bedroom 1.5 bath carriage house with its separate entrance from the alley is just waiting for new tenants. Sited among all that is happening—across from the Howard Theater, in the midst of Shaw, the bustling U Street corridor and steps from METRO—this home is urban living at its finest!",Active,14 days,Townhouse,,1900,LEDROIT PARK,"1,800 Sq. Ft.",DCDC2021902,"$1,799,000",$421,"$1,765,570",Federal,38.9158989,-77.0207518,Rory Obletz,Washington Redfin Agent,https://www.redfin.com/DC/Washington/619-Florida-Ave-NW-20001/home/10046100,Cleveland Elementary School,5,304
"810 O St NW #206,","Washington, DC 20001","$799,900",2,2.5,"1,236","PERLA: FINAL JUNIOR TWO BEDROOM- New pet-friendly condominiums in Shaw with full-time concierge, welcoming lobby/lounge area, and rooftop sky-lounge and terrace. Well-designed floorplans with white oak hardwood flooring throughout the living spaces and Porcelanosa tile floors in baths. Chef-grade kitchens feature Thermador appliances with gas cooking, quartz counters, and Italian cabinetry. Most homes, including this one, have attached outdoor spaces. . Please contact listing agent for private tour to select the right home for you. Photos are of model home.",Active,14 days,Condo,$917/month,2019,OLD CITY II,,DCDC2021982,"$799,900",$647,,Contemporary,38.9083318,-77.0236114,Rory Obletz,Washington Redfin Agent,https://www.redfin.com/DC/Washington/810-O-St-NW-20001/unit-206/home/177090580,Seaton Elementary School,8,390
"711 S St NW #2,","Washington, DC 20001","$559,000",1,1.5,502,"BUILT/CONSTRUCTED ABOUT 7 YEARS AGO! JUST NEWLY RENOVATED IN FALL 2021. UNIT IS ON THE LOWER LEVEL. STAINLESS APPLIANCES, HARDWOOD FLOORS, ETC. SHOWS REALLY WELL.",Active,14 days,Townhouse,$70/month,2015,OLD CITY II,,DCDC2021858,"$559,000","$1,114","$557,912",Contemporary,38.9142174,-77.0224944,Rory Obletz,Washington Redfin Agent,https://www.redfin.com/DC/Washington/711-S-St-NW-20001/unit-2/home/113745600,Cleveland Elementary School,5,304
"1128 6th St NW Unit FOUR,","Washington, DC 20001","$479,900",1,1,690,"Eleven 28 Condominiums features five one - two bedroom luxury units from 500-1,600 interior square feet. Residence #One features a kitchen with Calacatta Vagli Quartz, Delta Tinsic faucet and Bosch, Fulgar Milano and Samsung Smart appliances. The bathrooms feature Ocean Caliza Porcelanosa tiling, Venezia Quartz in White Snow counters and Kohler Plurist fixtures and accessories. Parking available for sale for $35,000. Builder is also building secured parking and fencing in the rear. The building is located just steps away from Downtown and Mt. Vernon Triangle's finest hospitality and retail including Rumi's Kitchen, RPM, and Truluck's restaurants, the Carnegie Library flagship Apple Store, Hermes, Tiffany and Christian Dior retailers and all of the amenities downtown living has to offer.",Active,14 days,Townhouse,$176/month,2021,OLD CITY II,,DCDC2021832,"$479,900",$696,"$488,842",Contemporary,38.9050216,-77.0202092,Rory Obletz,Washington Redfin Agent,https://www.redfin.com/DC/Washington/1128-6th-St-NW-20001/unit-4/home/177090792,Thomson Elementary School,6,331
"46 Channing St NW #2,","Washington, DC 20001","$649,000",2,2,"1,247","Stunning, spacious 2BR/2BA condo in sought-after LeDroit Park. Built in 2016, this home has been immaculately maintained and boasts over 1200 sq ft of living space, soaring 14’+ ceilings, gleaming acacia hardwood floors and exposed brick interior. Flooded with natural light, the large open floor plan is designed for modern living and is perfect for entertaining. The chef’s kitchen features marble countertops, stainless steel appliances, a breakfast bar and double-door pantry. This condo lives like a home, as an expansive gallery inspired hallway leads you to the bedrooms, including a luxurious owners’ suite with floor-to-ceiling windows, twin closets and a spa-inspired bath, complete with dual vanities and a large glass-enclosed shower. This also provides much needed privacy for couples working from home or who have conflicting schedules. Located directly across the street from the upcoming McMillan Park development and Harris Teeter, enjoy quiet living in a quaint neighborhood, with easy access to public transportation and a short stroll to the heart of Bloomingdale. Additional features: in-unit washer/dryer, ample closets and storage space (including secure outdoor storage shed), pet-friendly building, low monthly fees. There's also an outdoor storage unit that locks in the secured lot behind the building that's large enough to easily fit 2 bikes.",Active,14 days,Condo,$220/month,1908,LEDROIT PARK,,DCDC2021366,"$649,000",$520,"$673,071",Federal,38.922203,-77.010887,Rory Obletz,Washington Redfin Agent,https://www.redfin.com/DC/Washington/46-Channing-St-NW-20001/unit-2/home/108985267,Langley Elementary School,4,290
"58 Florida Ave NW,","Washington, DC 20002","$1,049,000",2,2,"2,259","Light and airy, this lovely row home boasts hardwood floors throughout the open floor plan. Bay windows offer sunlight and a perfect reading nook, while a fireplace anchors the living room. The eat-in kitchen features stainless-steel appliances, white cabinets and a window for growing herbs. The attached deck is a lovely spot for cocktails with friends or to enjoy your morning paper in the sun. Lined with windows, the primary bedroom has ample space for a home office, and a walk-in closet with organizers provides storage. The renovated bath with oversized subway tiles is a tranquil oasis. With a Certificate of Occupancy, the finished lower level has its own washer/dryer, full kitchen, full bath and living area -- a fantastic in-law suite or rental. Near coveted Mundo Verde Bilingual Charter School, this blossoming location is three blocks from the metro and all of the amenities of NoMa, Shaw and the convention center. Shop at Harris Teeter or Trader Joe’s, grab a coffee at Creative Grounds down the street, and enjoy a beer with friends at Dacha Beer Garden. A driveway provides off-street parking for one car.",Active,15 days,Townhouse,,1900,OLD CITY II,"1,110 Sq. Ft.",DCDC2021582,"$1,049,000",$464,"$1,041,156",Federal,38.9117092,-77.0116559,Rory Obletz,Washington Redfin Agent,https://www.redfin.com/DC/Washington/58-Florida-Ave-NW-20001/home/9888073,Seaton Elementary School,8,390
"1737 11th NW #100,","Washington, DC 20001","$1,300,000",3,3.5,"2,200","American Architect William Stulz, known for the design of many of The District’s churches, created 1737 11th Street NW in 1899. President William McKinley was serving his term and the Spanish-American war had just ended. This grand 4 story rowhouse stands at the crossroads of where Logan meets the Shaw Neighborhood. Just a couple blocks to the north, you will find U Street Corridor, which historically was known as “Black Broadway” where in the early 20th-century acts like Cab Calloway and Pearl Bailey once played. The collaboration of the 3 neighborhoods have a few things in common: Shopping, Dining, Parks, Public Transportation, and Music Venues. Welcome to The Lofton at Logan. Today, this grand piece of architecture has become a unique structure containing two fully-renovated, four-level, pristine condominiums by R Street Development and Harbor Builders. Each of the townhome-style condos feature 3-bedrooms + den, 3.5 -bathrooms, plus additional flexible living space spanning over 2,000+ SQFT. Enjoy entertaining on the rooftop decks, which are grandfathered a full story above the neighbors, with views of the Washington Monument and National Cathedral. Featuring custom finishes including Quartz countertops, Porcelanosa tile and White Oak flooring and custom gourmet kitchens which include Thermador and Bosch appliances. Unit #100 features historic Victorian-style Bay windows overlooking the tree-lined views of the newly renovated, Garrison Elementary, while Unit #200 boasts gorgeous living/dining space that is sun-lit by two levels of picture windows and private parking! Enjoy the quiet neighborhood feel while still living just a few blocks from the acclaimed restaurants of the 14th Street Corridor, Metro, Entertainment, Dog Parks, Coffee Shops, and retail. Buy as one, or purchase each unit separately. Condo paperwork onhand if sold individually. Live in one, and rent the other.",Active,15 days,Townhouse,$250/month,1900,LOGAN CIRCLE,,DCDC2000325,"$1,300,000",$591,"$1,300,588","Transitional, Victorian",38.9136454,-77.0267041,Rory Obletz,Washington Redfin Agent,https://www.redfin.com/DC/Washington/1737-11th-St-NW-20001/unit-100/home/174610615,Garrison Elementary School,9,277
"1737 11th St NW,","Washington, DC 20001","$2,700,000",—,—,"4,600","American Architect William Stulz, known for the design of many of The District’s churches, created 1737 11th Street NW in 1899. President William McKinley was serving his term and the Spanish-American war had just ended. This grand 4 story rowhouse stands at the crossroads of where Logan meets the Shaw Neighborhood. Just a couple blocks to the north, you will find U Street Corridor, which historically was known as “Black Broadway” where in the early 20th-century acts like Cab Calloway and Pearl Bailey once played. The collaboration of the 3 neighborhoods have a few things in common: Shopping, Dining, Parks, Public Transportation, and Music Venues. Welcome to The Lofton at Logan. Today, this grand piece of architecture has become a unique structure containing two fully-renovated, four-level, pristine condominiums by R Street Development and Harbor Builders. Each of the townhome-style condos feature 3-bedrooms + den, 3.5 -bathrooms, plus additional flexible living space spanning over 2,000+ SQFT. Enjoy entertaining on the rooftop decks, which are grandfathered a full story above the neighbors, with views of the Washington Monument and National Cathedral. Featuring custom finishes including Quartz countertops, Porcelanosa tile and White Oak flooring and custom gourmet kitchens which include Thermador and Bosch appliances. Unit #1 features historic Victorian-style Bay windows overlooking the tree-lined views of the newly renovated, Garrison Elementary, while Unit #2 boasts gorgeous living/dining space that is sun-lit by two levels of picture windows and private parking! Enjoy the quiet neighborhood feel while still living just a few blocks from the acclaimed restaurants of the 14th Street Corridor, Metro, Entertainment, Dog Parks, Coffee Shops, and retail. Buy as one, or purchase each unit separately. Condo paperwork onhand if sold individually. Live in one, and rent the other.",Active,15 days,Multi-Family (2-4 Unit),,1899,OLD CITY II,"1,467 Sq. Ft.",DCDC2000329,"$2,700,000",$587,"$2,553,555","Transitional, Victorian",38.9136454,-77.0267041,Rory Obletz,Washington Redfin Agent,https://www.redfin.com/DC/Washington/1737-11th-St-NW-20001/home/9876474,Garrison Elementary School,9,277
"2022 10th St NW,","Washington, DC 20001","$949,000",2,2.5,"1,416","* * PRICE IMPROVEMENT! JUST REDUCED $30K! Originally built c. 1880 and recently completely rebuilt to exacting standards, this spectacular two bedroom, two and one-half bath residence now offers a 21st Century aesthetic tucked behind an Historic, Turn-of-the-Century Federal facade. The property is sited on an exceptionally deep (99 ft) lot, which allows for the dramatic, open floor plan, soaring ceiling heights and spacious room sizes. This is further complemented by its East/West orientation, which draws abundant morning sunlight toward the front of the home, and facilitates phenomenal sunsets enjoyed from the newly re-landscaped rear garden & flagstone terrace! Additional features include: chefs kitchen with granite counters & breakfast bar, stainless steel appliances & gas range; dining area with exposed brick accent wall, first floor 1/2 bath, solid hardwood floors throughout, and a spacious family room / den with French doors opening to the rear garden, terrace & parking! The second level offers two spacious bedrooms, and two full spa-inspired baths, including the owners suite, which faces West, and offers ample room for a king-sized bed, and bath en-suite with travertine marble tile and oversized shower. The front bedroom is also exceedingly spacious and is highlighted by a coffered ceili with dual skylights. The current owners have meticulously maintained this property during their years there, and they installed a commercial grade Carrier HVAC in late 2020, as well as a brand new tankless hot water heater. Both systems are highly efficient, thus reducing energy consumption. With its front garden framed by an historic wrought iron fence, and a truly spectacular, newly landscaped garden, flagstone terrace & gated parking at the rear of the property, this home offers a terrific alternative to luxury condominium living. With an ideal location less than 1/2 block from METRO, two short blocks from the New Whole Foods Market, and other shops, restaurants and Atlantic Plumbing Theaters, and just steps to the vibrant U Street and Shaw neighborhoods, this property offers a rare opportunity for perfect City living on a quiet, tree-lined street in one of Washington's most desired neighborhoods",Active,15 days,Townhouse,,1880,OLD CITY II,"1,199 Sq. Ft.",DCDC2021778,"$949,000",$670,,Federal,38.9176896,-77.0262768,Rory Obletz,Washington Redfin Agent,https://www.redfin.com/DC/Washington/2022-10th-St-NW-20001/home/9876222,Garrison Elementary School,9,277
