"1010 Massachusetts Ave NW #308,","Washington, DC 20001","$684,990",2,2,994,"Welcome to Ten Ten Mass and your new home. This is a pet friendly, full service, luxury building that features a 24 hour concierge, rooftop pool, patio, and grilling area that offers awesome views of the city including the Capitol, Washington Monument, the fireworks display, and more. The view from the rooftop will not change due to building height restrictions in the area. The kitchen features granite countertops, stainless appliances, an island, space for a table, and a new refrigerator and dishwasher. The den has a closet, therefore, it can also be a great office or 2nd bedroom. Unlike some units in the building, this one features two full baths, however, the guest bath is accessible from the hall so your guests do not have to go through the bedrooms. The rooms are sunny with hardwood floors throughout (the bedroom floors were installed in June. ) The condo fee includes your parking space in the garage, heat - you control when it is on or off, - water, and all the services provided by the building. You also have two broadband services to choose from. Located within walking distance is City Center which features fine dining and luxury shopping such as Tiffany's, LV, Brioni and others. You are also right in the middle of Mount Vernon Triangle and close to four Metro Rail stations, the Convention Center, Capital One Arena, Downtown, K Street, the White House, the National Mall, and the newly renovated Franklin Square park.",Active,15 days,Condo,$784/month,2007,CENTRAL,,DCDC2021734,"$684,990",$689,,Contemporary,38.9033795,-77.0266704,Rory Obletz,Washington Redfin Agent,https://www.redfin.com/DC/Washington/1010-Massachusetts-Ave-NW-20001/unit-308/home/12533441,Thomson Elementary School,6,331
"22 Quincy Pl NW,","Washington, DC 20001","$1,075,000",3,3.5,"2,042","Open House on Sunday 12/5/21, from 12:00PM to 2:00PM Sentrilock is on the fence, to the right of the front door. Vacant show anytime between 8:00am - 8:00pm. Rarely, an urban beauty as special as this one becomes available in the city of Washington D. C. Beautifully restored, ideally located on a quiet one-way street in Bloomingdale. Location -location -location!!!! This is a perfect location with an eclectic mix of dining, retail, and entertainment options. Additionally, the location is key in terms of public transportation and grocery store selections which are accessible by walk or a short drive. Minutes to Union Station which is a historic landmark and one of the largest railway stations in the world. A few min drive to the US Capitol. A short walk to Union Market which is the epicenter of culinary creativity in DC with over 40 local vendors. This is a one-of-a-kind place to live, experience, and thrive in Washington, DC. The 2 floors of renovated living space that is charming featuring 3bedrooms, 2.5 baths. The lower level functions as a complete In-Law Suite, or rental unit with 1 bedroom, full bathroom, with most of the feature of a full kitchen need already there and everything ready to make the kitchen the way you want it. Currently, the basement unit is ready to be used as your entertainment room with a fully loaded wet bar included and ready to entertain your guests with style. The unit has a front entrance and a rear door that leads to the covered deck/yard. First floor of the house includes a nice size living room with dedicated dining area centered around two cozy fireplaces. The dining wet bar is a perfect way to bring the cocktail bar feel into your own home. A guest bathroom and coat closet is also located on the first floor. Continue through to the eat-in kitchen with dining area and breakfast bar. The Kitchen is spacious and renovated gourmet kitchen with eight-foot tall, full-light French doors that open up to a beautiful deck and private back yard. This home is filled with natural light that come from the abundance of windows and glass doors. Nice updated cabinets with custom lightings, double sink, and island. Stainless steel appliances with a heavy-duty double oven range with six burners and a griddle that ensures the chef can feed a crowd. A beautiful natural stone counter-top, which elegantly contrasts in the kitchen due to the plentitude of natural light. The kitchen comes with HEATED FLOORS. The 2nd floor begins with the gorgeous primary master bedroom, which has a fully-renovated bathroom with an antique claw-foot tub included, a separate shower and a double sink vanity that captures the beauty of its classic timeless style. The Master bedroom is large with a wall of built-in shelving and an entertainment center. The master bedroom has plenty of spacious closet spaces with Elf shelving & drawer system already in place. This master en suite has so much natural light via large windows and sky light in each rooms including the master bathroom. Furthermore, it has its own private balcony to top it all off. The master bath comes with HEATED FLOORS. All the other bedrooms are sun-flooded with skylights and large windows. This home has a dedicated laundry room. An interior stairway is in place to expand the living area of the house and connect the basement unit to the first floor. It can be enclosed or separated if needed only by means of locking the stairway door. This home is a must see!",Active,15 days,Townhouse,,1907,ECKINGTON,"1,439 Sq. Ft.",DCDC2021246,"$1,075,000",$526,"$1,078,766",Victorian,38.9116669,-77.009905,Rory Obletz,Washington Redfin Agent,https://www.redfin.com/DC/Washington/22-Quincy-Pl-NW-20001/home/10046721,Langley Elementary School,4,290
"1112 5th St NW #1,","Washington, DC 20001","$579,900",2,2,952,"Only 3 homes remain! Meticulously built new construction, this stunning 2 bedroom 2 bathroom home is in the heart of Mount Vernon Sq and features truly exquisite modern design behind a detailed, historic facade. The lovely kitchen features custom all wood kitchen cabinetry and island, stainless steel appliances, modern subway tile, and chrome plumbing fixtures. There are light-colored wide-plank hardwood floors throughout. The bedrooms are spacious, with room for a desk, and abundant western light. The closets are outfitted with custom organizers and the 9 foot plus ceilings leave nothing to be desired. This home offers a private patio and two private entrances. The location of this boutique collection of homes provides you access to the best parts of DC and is just seconds away from a Safeway, Starbucks, and everything Mount Vernon Square has to offer. A short 2 blocks to the metro puts the entire region at your front door. Blocks to 395 tunnel.",Active,14 days,Condo,$154/month,2020,MOUNT VERNON,,DCDC2021966,"$579,900",$609,,"Victorian, Condo/Unit",38.9048118,-77.0191492,Rory Obletz,Washington Redfin Agent,https://www.redfin.com/DC/Washington/1112-5th-St-NW-20001/unit-1/home/174421472,Walker-Jones Education Campus,3,384
"910 M St NW #908,","Washington, DC 20001","$549,000",1,1,735,"Freshly painted and ready for you. Dark wood floors, Open Kitchen, private bedroom with large closet. Many windows. This building has so many amenities. The pool and deck are outstanding. Comes with assigned parking - 225-C . Easy commute and gorgeous building.",Active,16 days,Condo,$639/month,2006,OLD CITY II,,DCDC2019280,"$549,000",$747,,Colonial,38.9054055,-77.0246698,Rory Obletz,Washington Redfin Agent,https://www.redfin.com/DC/Washington/910-M-St-NW-20001/unit-908/home/11746878,Thomson Elementary School,6,331
"448 Q St NW #1,","Washington, DC 20001","$1,199,900",3,2.5,"2,145","Indulge yourself in this sophisticated and modern, new construction residence! Striking two-level condominium with 2 Bedrooms + Den and 2.5 Baths and with your own outdoor space. 448 Q Street presents two homes that have been expertly thought-out and finely crafted, defining urban luxury. Comfortable open floor plans and a decadent list of designer details complete this offering. Updated for today's discerning resident, the smart floor open plan seamlessly connects living & dining spaces with a chef's kitchen featuring professional-grade appliances on the main level. This level also offers over-sized windows affording an abundance of natural light, and a convenient half-bath for guests. Level two is the private area of the residence with 3 bedrooms and 2 luxurious bathrooms. This home is finished to the highest standards, in the heart of Shaw! An impressive array of award winning restaurants, boutiques, fitness studios, and services just blocks away! Parking available for sale.",Active,16 days,Townhouse,$220/month,2021,SHAW,,DCDC2021642,"$1,199,900",$559,"$1,200,397",Traditional,38.910861,-77.018271,Rory Obletz,Washington Redfin Agent,https://www.redfin.com/DC/Washington/448-Q-St-NW-20001/unit-1/home/176103900,Seaton Elementary School,8,390
"626 Harvard St NW,","Washington, DC 20001","$900,000",—,—,"1,634","Developers & Investors: here is the opportunity to use that 1031 Exchange or maybe just to invest in this property which sits on an OPPORTUNITY ZONE Area: contact Opportunity Zone Attorney to find out how to structure the deal with an Opportunity Zone fund so that you may benefit from this TAX-FREE SHELL opportunity! Plans & permits approved by DCRA will convey with the sale of the property. The plans are for 2 condominiums featuring 3 beds and 3 full baths about 1800 sq ft per condominium. Also, with the sale of this property will convey the separate deeds! Appraisal report also available, which shows the value of $1,700,000 for both units! You heard that right! Everything is already taken care of! Hit the run, and start construction right after settlement! Feel free to contact listing agent with any questions or concerns you may have!",Active,10 days,Multi-Family (2-4 Unit),,2022,COLUMBIA HEIGHTS,"1,070 Sq. Ft.",DCDC2022224,"$900,000",$551,"$882,753",,38.9272321,-77.0225058,Rory Obletz,Washington Redfin Agent,https://www.redfin.com/DC/Washington/626-Harvard-St-NW-20001/home/10045169,Bruce-Monroe Elementary School At Park View,8,451
"2016 2nd St NW Unit A,","Washington, DC 20001","$750,000",2,2.5,"1,340","This brand new, ground up, luxury townhome condominium offers 4-levels of pure bliss. Boasting a modern open floor plan with bountiful natural light on all levels. Every inch of this space has been tastefully designed and constructed for your utmost living pleasure. Upon entering the first level you are met with the first bedroom and full bathroom, perfect for guests, a study, or bonus room with endless potential. Welcoming you to the second floor, the sharp gourmet kitchen was built with custom cabinetry, quartz countertops, complimented by original, reclaimed, exposed beams, stainless steel energy-efficient appliances, custom hardwood floors, and a convenient 1/2 bath, all located on second level. Flowing from the kitchen is a designated dining area that leads to an expansive living space. Don't just look down, as you gaze up you will notice the elegant crown molding and finish carpentry that is throughout the building. The hand crafted railings fit perfectly to the space. Just one floor above the kitchen, living, dining area lies a one-of-a-kind master ensuite. The full level boasts a spa-like bathroom, with a free standing tub, multiple waterfall shower heads as well as wands, and a spacious double vanity. You have not just one large closet, but two as well as two other auxiliary closets on this master level. The bedroom has ornate architecture and style, while being large enough for a king bed or more! Just as you are regaining your breath from this unbelievable master level, you see stairs leading to your private, 450+ est. sq. ft. rooftop deck. Fitting with lighting, a hose bib, as well as gas line for all your entertaining needs filled with a gorgeous view of the DC Skyline. No detail was missed in this luxurious build as it was meticulously crafted for the best of the city's offerings. Close to the hustle and bustle on U St/14th St yet nestled in the quaint neighborhood of LeDroit Park, this is truly the perfect location to be. Steps from the metro, groceries, shopping, restaurants galore, and more. We cannot wait for you to come and experience this one-of-a-kind home for yourself! * Note: Square footage is estimated from architectural drawings * * Pictures of neighboring 2014 building, sq. ft. and layouts estimated to be the same for both buildings *",Active,29 days,Townhouse,$216/month,2021,LEDROIT PARK,,DCDC2020020,"$750,000",$560,"$752,670",Contemporary,38.918314,-77.015001,Rory Obletz,Washington Redfin Agent,https://www.redfin.com/DC/Washington/2016-2nd-St-NW-20001/unit-A/home/177075703,Cleveland Elementary School,5,304
"2905 Georgia Ave NW #3,","Washington, DC 20001","$344,900",1,1,459,"$5000 CLOSING COST CREDIT! Introducing The Maddox, a new condominium community rising up along Georgia Avenue in Washington's vibrant Park View neighborhood. Take the opportunity to purchase one of these fantastic new condominium homes! The Maddox's beautiful one-bedroom and one+den floorpans offer sleek interiors that allow your personal style to take center stage! We are excited to introduce you to this new community. If you would like to schedule your private appointment or virtual tour, please contact us! Homes Priced from $299,900 to $454,900.",Active,13 days,Condo,$220/month,2021,PARK VIEW,,DCDC2022046,"$344,900",$751,"$344,642","Contemporary, Condo/Unit",38.927509,-77.0227493,Rory Obletz,Washington Redfin Agent,https://www.redfin.com/DC/Washington/2905-Georgia-Ave-NW-20001/unit-3/home/177100167,Bruce-Monroe Elementary School At Park View,8,451
"424 Warner St NW,","Washington, DC 20001","$799,900",3,2.5,"1,625","AMAZING opportunity for Home-Owner, Investor or Developer in rapidly appreciating neighborhood. Spacious 3 bedroom, 2.5 bath home on quiet block conveniently located steps from Metro, restaurants, and all the amenities of SHAW. This home is has an open floor plan with hardwood floors, recessed lighting, exposed brick walls, interior skylight, and 2 fireplaces. The primary bedroom has a fireplace and private bath. Gourmet kitchen with granite countertops, stainless steel appliances that opens to a deck, large backyard with parking. OPEN HOUSE on SUNDAY, November 21st, 2-4 PM",Active,13 days,Townhouse,,1900,OLD CITY II,"1,607 Sq. Ft.",DCDC2021538,"$799,900",$492,"$825,119",Traditional,38.9116932,-77.0180107,Rory Obletz,Washington Redfin Agent,https://www.redfin.com/DC/Washington/424-Warner-St-NW-20001/home/9883786,Seaton Elementary School,8,390
"1550 11th St NW #401,","Washington, DC 20001","$1,399,900",3,2,"1,847","OPEN: SUN, 11/21, from 1 PM - 3 PM. Welcome to Holm, a collection of 38 luxury condominiums in vibrant Logan Circle. Holm is located at the intersection of 11th Street & Rhode Island Avenue in NW DC, just east of the booming 14th Street corridor. Holm's modern design reflects a relaxed urban luxury and residences feature custom built-in kitchens and millwork, 5"" wide plank hardwood floors throughout with sound deadening cork, expansive windows and European frameless cabinetry. The amenity-rich, pet-friendly building, with an ELEVATOR, also boasts a common roof terrace with stunning city views. Most homes will come with a private terrace and/or balcony. Unit 401 is the PREMIER PENTHOUSE at HOLM, a luminous and spacious CORNER DUPLEX featuring 3BR/Loft/2BA with NORTHERN, EASTERN & WESTERN exposures, a MASSIVE PRIVATE TERRACE and a FULL-SIZE GARAGE PARKING SPACE. The Penthouse features copious amounts of storage, brand new hardwood floors throughout and a brand new kitchen with Bertazzoni appliances.",Active,20 days,Condo,$871/month,2019,OLD CITY II,,DCDC2021160,"$1,399,900",$758,"$1,395,244",Contemporary,38.9109399,-77.027264,Rory Obletz,Washington Redfin Agent,https://www.redfin.com/DC/Washington/1550-11th-St-NW-20001/unit-401/home/171547025,Garrison Elementary School,9,277
"1720 New Jersey Ave NW #102,","Washington, DC 20001","$649,000",2,2,"1,055","PRIVATE OUTDOOR PATIO that doubles as a second living room! The light filled, ABOVE GRADE Unit offers room to grow! The spacious living area offers multiple furniture placement options. Secure, underground GARAGE PARKING INCLUDED!!!. Located within a Contemporary boutique building in the heart of the Shaw neighborhood, this residence boasts a thoughtful layout, ample space, and natural light throughout. The European inspired kitchen provides an incredible entertaining space, outfitted with a suite of stainless steel appliances, expansive counters, and abundant cabinet space. Each bedroom features multiple windows and walk in closets and the Primary bedroom is adorned with an en-suite bathroom. To complete this one-of-a-kind offering, the building has a communal roof deck that is a great place for unwinding, working from home, and more - offering sweeping city, Capitol, and Monument views. The Hoxton is a concrete building with ELEVATOR access to each floor and the garage - very rare for boutique buildings!",Active,17 days,Condo,$349/month,2018,OLD CITY II,,DCDC2021302,"$649,000",$615,"$649,175",Condo/Unit,38.9131645,-77.0179594,Rory Obletz,Washington Redfin Agent,https://www.redfin.com/DC/Washington/1720-New-Jersey-Ave-NW-20001/unit-102/home/175118776,Seaton Elementary School,8,390
"777 7th St NW #426,","Washington, DC 20001","$714,900",2,2,994,"City life at its finest! Unbeatable sun-soaked 2 bed, 2 bath corner unit in Chinatown! This lovely unit offers a recently renovated kitchen, new HVAC system, floor-to-ceiling windows, hardwood floors, incredible views, California closets, and recessed lighting. Become a chef and cook for guests in your fully-equipped kitchen featuring new LG stainless steel appliances, Quartz countertops, a breakfast bar, beautiful marble tile backsplash and white cabinets. The bright and spacious living room is perfect for lounging and offers unbelievable views of 7th St NW. The primary suite includes an ensuite bathroom and a large walk-in closet (perfect for storing all your winter clothes). Use the second bedroom as a guest suite or home office. The stacked washer and dryer are hidden out of sign in the hallway closet with new built-in storage above. Countless amenities including a roof terrace on the third floor, dog area on the seventh floor, 24/7 concierge, a business center, party room, and gym. The Building's Operations and Business Manager and engineer are on site from M-F to support any daily needs. PRIME LOCATION - conveniently located near the Capital One Arena, Clyde's Restaurant, Regal Theater, Gallery Place Metro Station, National Portrait Gallery and much more! Transportation made easy with Union Station just a 5 minute Metro ride away and Reagan a 12 minute Metro ride away!",Active,21 days,Condo,"$1,023/month",2005,CENTRAL,,DCDC2021118,"$714,900",$719,"$703,869",Contemporary,38.8994495,-77.0215209,Rory Obletz,Washington Redfin Agent,https://www.redfin.com/DC/Washington/777-7th-St-NW-20001/unit-426/home/10192996,Thomson Elementary School,6,331
"925 H St NW #810,","Washington, DC 20001","$2,474,900",2,2.5,"1,378","Be Amazed! A Spectacular1000+ square foot Private Sky Terrace with Three Exposures conveys with this stunning light filled Corner residence boasting Two Primary Bedroom Suites, each with ensuite bath, and a dramatic living room - dining room with walls of glass opening onto to the Private Sky Terrace for seamless indoor -outdoor entertaining. Park the cars in your own Two Personal Parking Spaces, store your suitcases in your additional storage space. With unparalleled service and amenities at your fingertips - museums, theatres, sports venues, fine dining and world class shopping at your doorstep - you may never want to leave! The Residences at CityCenterDC, Washington's premier luxury development designed by internationally acclaimed architect Foster + Partners, it's a choice lifestyle! Doorman Building.",Active,22 days,Condo,"$1,890/month",2013,CENTRAL,,DCDC2020750,"$2,474,900","$1,796",,Contemporary,38.9000865,-77.0245111,Rory Obletz,Washington Redfin Agent,https://www.redfin.com/DC/Washington/925-H-St-NW-20001/unit-810/home/55187197,Thomson Elementary School,6,331
"51 Hanover Pl NW,","Washington, DC 20001","$730,000",4,2,"1,406","Fantastic rowhome on a quiet one-way street in the heart of the city. Just a short walk to many cafes, restaurants, bars, and Metro (9 minutes), 51 Hanover combines usable living space with an exceptional location. Laminate wood flooring on the main level, new carpet upstairs, and fresh paint throughout. The open floor plan is excellent for entertaining, and the back patio is perfect for the summer and spring. One bedroom with full bathroom on the main level, along with three bedrooms, full bath, and washer/dryer upstairs.",Active,22 days,Townhouse,,1912,OLD CITY II,975 Sq. Ft.,DCDC2020898,"$730,000",$519,"$730,344",Federal,38.9080341,-77.0105537,Rory Obletz,Washington Redfin Agent,https://www.redfin.com/DC/Washington/51-Hanover-Pl-NW-20001/home/9888575,Walker-Jones Education Campus,3,384
"150 Rhode Island Ave NW #303,","Washington, DC 20001","$595,000",2,2,975,"Welcome to The Seaton! This charming historic building is located in DC’s vibrant Bloomingdale neighborhood. Situated on the corner, the unit features large windows, allowing for an abundance of natural light and views of mature trees, hardwood flooring throughout, open kitchen/living room/dining room, 2 bedrooms, 2 full baths, gas fireplace and recessed lighting throughout. Upgrades include Elfa closet systems, brand-new stainless-steel refrigerator, new dishwasher in 2018, HVAC replaced in July 2019, new hot water heater in 2021, and primary bathroom renovated in March 2019. The building also features extra storage and bike room in the basement as well as a secured picnic/grill area out front. With a walk score of 93, bike score of 82 and transit score of 77, the location cannot be beat! Just one block from neighborhood favorites such as Boundary Stone, Red Hen, Etabli Wine Bar, Bacio Pizzeria, Yoga District, Aroi Thai, dry cleaners and corner markets, you can accomplish quick, daily errands on foot. Enjoy a relaxing weekend with a short walk to Big Bear, Creative Grounds Café, Crispus Attucks Park, the Park at Ledroit and the Bloomingdale Farmers Market! Convenient to major bus routes (G8/G2/80/90s) and under 12 minute walk to metro (Shaw/ green and yellow lines). Come join this wonderful community!",Active,24 days,Condo,$304/month,1910,ECKINGTON,,DCDC2019382,"$595,000",$610,"$595,878","Condo/Unit, Traditional",38.9149428,-77.0137367,Rory Obletz,Washington Redfin Agent,https://www.redfin.com/DC/Washington/150-Rhode-Island-Ave-NW-20001/unit-303/home/21647488,Langley Elementary School,4,290
"1512 6th St NW,","Washington, DC 20001","$3,195,000",—,—,"5,040","1512 6th Street NW is a stunning new development by District Quarters. Perfectly situated in Shaw, this thoughtfully designed building features two brand new, multi-level, three bedroom condominiums. The main level unit has a spacious outdoor terrace and the penthouse unit includes a private rooftop deck. Both units include off street parking. Throughout the building there are beautiful finishes including oak hardwood floors, stainless steel appliances, and quartz countertops, which compliment the clean, modern style and unique craftsmanship. Residents of Shaw enjoy the urban convenience like no other, with shops, restaurants, nightlife, and historical landmarks nearby. 1512 6th Street NW offers the ideal blend of sophistication and urban living within one of DC’s most exciting neighborhoods.",Active,16 days,Multi-Family (2-4 Unit),,2021,OLD CITY II,"2,100 Sq. Ft.",DCDC2021480,"$3,195,000",$634,"$2,982,194",Contemporary,38.9102099,-77.0201939,Rory Obletz,Washington Redfin Agent,https://www.redfin.com/DC/Washington/1512-6th-St-NW-20001/home/9879331,Seaton Elementary School,8,390
"1128 6th NW Unit FIVE,","Washington, DC 20001","$1,049,900",3,2.5,"1,508","* $50,000 price reduction!!! * Situated in the burgeoning Mt. Vernon triangle/square neighborhood Eleven 28 Condominiums is a wonderfully quaint 5-unit boutique building. Residence #5 is a sun filled modern residence which features a massive first floor main level anchored by a 10 foot island that centers the space and separates the formal living and dining rooms. . The kitchen is equipped with top of the line finishes including Calacatta Laza Quartz counters and backsplash, and Bosch and Samsung Smart appliances. The bathrooms feature Ocean Caliza Porcelanosa tiling with Kohler Plurist fixtures and accessories and a primary bathroom with heated flooring. The 2nd floor sleeping level has three spacious bedrooms. This unit comes with one secured garage parking space. Seller is building fencing and roll up garage to secure rear area. * #5 also will have a 4x8 interior storage room included * Available customization for inclusion of front interior stairway from first to second floor, ask agent for details * * Units are still being completed and punched out in many areas The building is located just steps away from Downtown, the Mt. Vernon/Convention Center Metro (green/yellow line), Mt. Vernon Triangle's finest hospitality and retail including Rumi's Kitchen, RPM, and Truluck's restraurants, the Carnegie Library flagship Apple Store, Hermes, Tiffany and Chrisian dior retailers and all of the amenities downtown living has to offer.",Active,36 days,Townhouse,$363/month,2021,OLD CITY II,,DCDC2001635,"$1,049,900",$696,"$1,035,589",Contemporary,38.9050216,-77.0202092,Rory Obletz,Washington Redfin Agent,https://www.redfin.com/DC/Washington/1128-6th-St-NW-20001/unit-5/home/177090794,Thomson Elementary School,6,331
