"1901 37th St NW,","Washington, DC 20007","$1,975,000",3,4.5,"2,900","This one of a kind home has undergone a complete renovation and expansion by one of Washington's foremost builders. Painstaking efforts were made to retain the classic charm of the home while thoroughly modernizing it from head to toe. Details like hardwood floors, crown molding, recessed lighting and custom cabinetry can be found throughout this extraordinary home that spans nearly 3,000 square feet. An elegant stone walkway and distinctive portico lead to the main level that features an expansive living room with multiple exposures and a fireplace flanked by built-in shelving. A cozy eat-in area is adjacent to an inviting den with multiple windows, a fireplace and custom moldings and cabinetry. The kitchen has custom inset cabinets, high-end appliances including an AGA range, two sinks and ample counter space. The dining room is large and light filled with a wall of windows and French doors leading to the lovely deck. An elegant powder room and functional mudroom finish out this level. The upper level features two large bedrooms each with beautifully updated en suite bathrooms and walk-in closets with systems for storage. An office that could be converted to a bedroom and a series of hall closets for extra storage complete the upper level. The lower level has ample storage throughout as well as a large laundry room, flex room, full bath. A well proportioned guest suite features an en suite bathroom and kitchen with SubZero refrigerator and freezer drawers along with a private entrance. The outdoor space is enchanted with lush plantings, custom fencing, patio space for entertaining and expansive green spaces. Two outdoor closets and a parking pad add both convenience and utility to this outdoor oasis. Striking the perfect balance of traditional appeal with modern updating, this light filled home with its perfect location in the heart of Burleith is not to be missed.",Active,21 days,Townhouse,,1924,BURLEITH,"3,737 Sq. Ft.",DCDC2020500,"$1,975,000",$681,"$2,146,951",Traditional,38.9155464,-77.0725345,Katie Scire,Washington Redfin Agent,https://www.redfin.com/DC/Washington/1901-37th-St-NW-20007/home/9932360,Hyde-Addison Elementary School At Meyer,6,352
"4000 Tunlaw Rd NW #516,","Washington, DC 20007","$479,000",2,2,"1,093","High end renovation in 2020 (not a flip). Used as second home. Enjoy relaxing in front of the top of line opti-v-duet fireplace set in marble tile. Entertain at the newly added island or in the dining area. New kitchen with quartzite counters, new cabinets, and appliances. New luxury vinyl flooring throughout unit except in bathrooms which have new tile. Two full, renovated bathrooms. Tons of windows and closet space in this spacious unit. Unit conveys with reserved parking space in gated parking lot. Second floor assigned storage cage approx. 7' x 3' x 8'. Enjoy building amenities that include rooftop with comfortable seating areas overlooking the National Cathedral, recently renovated fitness center, large pool (seasonal), 24 hour front desk who will receive your packages, lower level convenience store and dry cleaner. Close proximity to grocery stores (Trader Joe's, Safeway, and Whole Foods), restaurants, neighborhood garden, National Park walking trails, playground, and more. HOA/Condo fees in addition to normal items also includes the unit's heat, A/C, electric, gas, and water. No additional assessment for planned building maintenance beyond the monthly condo fees.",Active,23 days,Condo,"$1,078/month",1960,GLOVER PARK,,DCDC2020868,"$479,000",$438,"$467,585",Contemporary,38.9252674,-77.0804147,Tiernan Dickens,Washington Redfin Agent,https://www.redfin.com/DC/Washington/4000-Tunlaw-Rd-NW-20007/unit-516/home/9959423,Stoddert Elementary School,9,463
"2500 Q St NW #246,","Washington, DC 20007","$223,000",—,1,364,"Your Gateway to Georgetown living! This darling studio is the perfect first condo or a wonderful investment opportunity. A nice sized unit, with an unbelievably low condo fee that includes all utilities! A huge walk-in closet, a wainscoted-adorned bath, and a generous kitchen with gas cooking and stainless-steel appliances complete this compact home. Building amenities are abundant! A 24-hour front desk concierge, bike storage, rooftop deck with stunning views, a community meeting room that’s a perfect work from home spot, storage space/cages available for rent, onsite management, building maintenance and porter staff, loading dock and a freight elevator to make move-ins easy, secure 24-hour package locker system, and a fitness center for an small additional use fee. The community laundry room is nicely appointed, updated, modern and connected to an app so you can see what machines are available or the time left on your cycle. Cat friendly building. Parking is often available for rent, not guaranteed. FHA and VA Approved. Walk to Dupont or into the heart of Georgetown in minutes. Steps to Rose Park, restaurants, shopping and more!",Active,25 days,Condo,$228/month,1942,GEORGETOWN,,DCDC2020104,"$223,000",$613,,,38.9103711,-77.0520839,Tiernan Dickens,Washington Redfin Agent,https://www.redfin.com/DC/Washington/2500-Q-St-NW-20007/unit-246/home/9929261,Hyde-Addison Elementary School At Meyer,6,352
"4012 Edmunds St NW Ph -2,","Washington, DC 20007","$649,000",2,2,820,"Cathedral Towers penthouse with two bedrooms, two full baths featuring reserved parking and an expansive newly refinished private roof deck overlooking Glover Archbold Park. Luxurious finishes with 10 foot ceilings, recessed lighting, beautiful acacia hardwood floors, KitchenAid stainless steel appliances, white shaker cabinets and quartz counters with a kitchen island. Large sliding glass door leading to a balcony off the living room. Primary bedroom featuring an en suite bath with double sink vanity with porcelain & carrara marble. Reserved parking space #5 and stacked full size washer/dryer in unit. A couple blocks to Safeway, Trader Joes, shops and the Whole Foods (opening soon).",Active,26 days,Condo,$327/month,1939,GLOVER PARK,,DCDC2020408,"$649,000",$791,,Condo/Unit,38.9244014,-77.0797336,Tiernan Dickens,Washington Redfin Agent,https://www.redfin.com/DC/Washington/4012-Edmunds-St-NW-20007/unit-2/home/145428622,Stoddert Elementary School,9,463
"2141 Wisconsin Ave NW #602,","Washington, DC 20007","$375,000",1,1,611,"Welcome Home! Gorgeous one bedroom located in the middle of Georgetown and Glover Park, this home features a great floor plan, updated kitchen with granite countertops and stainless steel appliances. The updated bath and spacious bedroom make this condo ready to move in. The balcony overlooks observatory circle with views of the National Cathedral and Washington Monument! One coveted garage parking space conveys plus extra storage cage is included in list price! Building is professionally managed and showcases a gorgeous outdoor courtyard perfect for outdoor gatherings. Located in a fantastic location, within walking distance to numerous restaurants, shops, cultural attractions, transportation and so much more! Not to be missed!",Active,30 days,Condo,$411/month,1941,OBSERVATORY CIRCLE,,DCDC2019674,"$375,000",$614,"$370,870",Traditional,38.9191321,-77.0700725,Tiernan Dickens,Washington Redfin Agent,https://www.redfin.com/DC/Washington/2141-Wisconsin-Ave-NW-20007/unit-602/home/9933191,Stoddert Elementary School,9,463
"2606 Tunlaw Rd NW #2,","Washington, DC 20007","$324,995",1,1,533,"MUST SEE! Located in the extremely desirable Glover Park Georgetown North Condo, this unit is the perfect inside corner unit offering wonderful quiet and privacy. This home uses the square footage so well - large rooms, no hallways- allowing the maximum use of space. Fabulous use of open floor plan, flows wonderfully with an open and bright space for living and entertaining, with a wood burning fireplace that is central to both dining area and living room, adding wonderful warmth, comfort and charm to the home. The beautiful new kitchen boasts stainless steel appliances and gorgeous granite countertops, white cabinetry, gray luxury granite planking and new lighting. The spacious bedroom has two closets, wood flooring and new lighting. The full bathroom has been beautifully renovated. Washer and dryer in unit! ASSIGNED PARKING SPACE! Low monthly condo fees, ample street parking for guests, and recent HVAC completes this perfect home. SO CLOSE TO FABULOUS SHOPS, GROCERIES, OPEN SPACE, GEORGETOWN!",Active,30 days,Condo,$310/month,1954,GLOVER PARK,,DCDC2019488,"$324,995",$610,"$321,347",Condo/Unit,38.9240789,-77.0757058,Tiernan Dickens,Washington Redfin Agent,https://www.redfin.com/DC/Washington/2606-Tunlaw-Rd-NW-20007/unit-2/home/9935354,Stoddert Elementary School,9,463
"3045 West Lane Kys NW,","Washington, DC 20007","$4,750,000",5,5.5,"3,095","Stunning, fully renovated East Village Georgetown townhouse designed by renowned architect Christian Zapatka and Azali Kassum Design. This exceptional townhouse features over 4,000 square feet of luxurious living space across four levels with a gated driveway on one of Georgetown’s most private streets. The five bedroom, five and a half bath home has two custom Snaidero kitchens imported from Italy, two primary bedroom suites with ensuite baths, white oak plank flooring, private garden, finished lower level and custom elevator to all floors. The first floor features an open and light-filled floor plan with chevron design wood floor entry featuring Circa Lighting, elegant powder room with Waterworks finishes, walk in coat closet, living room with a custom fireplace featuring Gioia Venatino marble and hideaway bar with wine fridge. Beautiful custom designed eat-in kitchen features Snaidero cabinetry, Miele appliances, marble backsplash and white quartz countertops, gorgeous waterfall island and end to end storage. The second floor features two large primary bedroom suites with bespoke custom closets and luxurious en-suite baths. All baths are designed with White Thassos marble flooring, quartz, Lacava soaking tubs with walk-in showers featuring Waterworks fittings throughout. A finished outdoor patio space separates this floor with sky light to the lower level and double door access to the hallway. The third floor, which was previously unfinished attic space, now fills the home with natural light by way of an oversized window in the hallway. This floor has two large bedrooms with en-suite bathrooms featuring ceramic tiles from the Ann Sacks Savoy collection and Carrara marble also featuring walk-in showers with Waterworks fittings. One bedroom can double as an office with custom built-ins and desk space. The fully renovated lower level (also served by the elevator) features all slate flooring, with a large family room with fireplace clad in Carrara Marble and a full second custom Snaidero kitchen with white quartz countertops which open to the living room and Ann Sacks backsplash. This creates an ideal entertainment space or guest suite with a full bedroom, bathroom, laundry area, and a separate outdoor entrance. Bedroom can also be used as a gym. Exterior includes locked storage. This fabulous move in ready home has all new HVAC and water heaters, all new electrical and plumbing, second floor laundry and linen storage, lower level laundry, new security system, Ring doorbells, updated new windows, exterior and interior doors throughout. The neutral palette provides a perfect backdrop for contemporary living. A must see.",Active,32 days,Townhouse,,1958,GEORGETOWN,"2,035 Sq. Ft.",DCDC2019498,"$4,750,000","$1,535","$4,660,633",Contemporary,38.909943,-77.0609248,Katie Scire,Washington Redfin Agent,https://www.redfin.com/DC/Washington/3045-W-Ln-Kys-NW-20007/home/9929882,Hyde-Addison Elementary School At Meyer,6,352
"1077 30th St NW #702,","Washington, DC 20007","$920,000",2,2,"1,162","Welcome to James Place Condominium tucked away in a private courtyard and situated in the highly desirable Georgetown neighborhood. This well-appointed, chic penthouse is an ideal hub to any home buyer or urban dweller looking for a unique niche in Washington, D. C. Bright and airy, this west-facing residence displays rare sunset views over historic Georgetown. The living room is spacious with an open layout, blonde maple floors and a cozy sitting alcove to enjoy a quiet night with a great book or a movie. The dining room opens to the living room for fuss-free entertainment. The high-end kitchen has modern, high-glass white cabinetry and tailor cut Italian marble countertops. The light filled master bedroom features en suite bathroom with shower, real wood burning replace and a tranquil atmosphere for relaxation. The large second bedroom is flooded with natural light. The guest bathroom is spacious with double vanity, a bathtub with glass enclosure and integrated cabinets for extra storage. Custom closets galore throughout the entire home.",Active,32 days,Condo,$914/month,1980,GEORGETOWN,,DCDC2001159,"$920,000",$792,"$898,551",Contemporary,38.9035428,-77.0589685,Tiernan Dickens,Washington Redfin Agent,https://www.redfin.com/DC/Washington/1077-30th-St-NW-20007/unit-702/home/9924348,Hyde-Addison Elementary School At Meyer,6,352
"2655 41st St NW #304,","Washington, DC 20007","$275,265",1,1,588,"Glover park opportunity knocks! Classic NW DC turn of the century style with an amazing location close to Parks, community garden, bus routes, and the best amenities, nightlife, and dining that Glover Park and Georgetown have to offer! 2611 41st is a boutique building that is professionally managed and the reasonable condo fee means less stress for all owners, there is common laundry and roof deck as well as secured entry. Proximity to Universities, embassies, and businesses make this a strong investment option or an affordable first-time buyer option with room to further update to your specific tastes. Multiple Bus routes close by make a commute north to Tenleytown or Friendship Heights easy and an even quicker ride down to Georgetown or across to river to Northern VA. Welcome home !",Active,43 days,Condo,$450/month,1939,GLOVER PARK,,DCDC2017704,"$275,265",$468,"$269,736",Traditional,38.9244566,-77.0801953,Tiernan Dickens,Washington Redfin Agent,https://www.redfin.com/DC/Washington/2655-41st-St-NW-20007/unit-304/home/9964943,Stoddert Elementary School,9,463
"2725 39th St NW #512,","Washington, DC 20007","$450,000",2,1,974,"Building and unit were beautifully renovated between 2004-2006, and one of the largest units in The Archbold! This top floor corner unit showcases neutral paint, hardwood floors throughout, stainless steel appliances, and granite counters. The living room lets in ample natural light, and the dining room has plenty of space, great for entertaining. This unit features a two-in-one washer/dryer, new in 2019, and the spacious bedrooms/closets offer you two choices for primary bedrooms. HVAC units in living room and both bedrooms for individual comfort. ALL UTILITIES INCLUDED in the condo fee, except for cable/internet. The Archbold is a pet-friendly building, and investor friendly building with no rental restrictions outside of short term rentals. Solar Panels have been installed on the building in an effort to be more eco friendly. More building amenities include bike storage, a second-floor lounge/party room with a baby grand piano and kitchen, and mail room for packages. The secure building is accessed by fob at the front and rear entrance. Plenty of on-street parking around the building. Walk Score of 79! Nearby shopping and restaurants include: Trader Joe's (. 9 miles) , Safeway (1 mile), Old Europe (. 5 miles), Rocklands BBQ (. 5 miles), Ace Hardware (. 6 miles), and Whole Foods (to reopen next year) , Georgetown University (1.5 miles), American University (. 9 miles). Bus stop for route D2 is less than a block away. Explore Glover Park's trails, Stoddard and Guy Mason Recreation Centers, and a nearby dog park. Wilson High School Pyramid. This is the perfect condo to call your home!",Active,35 days,Condo,$705/month,1959,GLOVER PARK,,DCDC2018196,"$450,000",$462,"$444,623",Traditional,38.9253064,-77.0786162,Tiernan Dickens,Washington Redfin Agent,https://www.redfin.com/DC/Washington/2725-39th-St-NW-20007/unit-512/home/11747296,Stoddert Elementary School,9,463
"2800 Wisconsin Ave NW #202,","Washington, DC 20007","$205,000",—,1,392,"Light filled studio in perfect location! Turnkey efficiency offering hardwood flooring, stainless steel appliances with kitchen breakfast counter, plentiful closets and front desk concierge. Pets allowed (one lap-size pet per unit). Small storage unit included. $426 monthly condo fee includes Electric, Gas, Heating , Air conditioning, Water, Garbage removal, Maintenance of building and grounds, Security and Management. Walk to Glover Park Whole Foods or all the offerings near Cathedral Commons!",Active,29 days,Condo,$426/month,1964,OBSERVATORY CIRCLE,,DCDC2020112,"$205,000",$523,"$201,924",Traditional,38.9264964,-77.0734771,Tiernan Dickens,Washington Redfin Agent,https://www.redfin.com/DC/Washington/2800-Wisconsin-Ave-NW-20007/unit-202/home/9974100,Stoddert Elementary School,9,463
"2500 Q St NW #445,","Washington, DC 20007","$379,000",1,1,887,"Welcome home to Gateway Georgetown Condominium in one of DC's most quintessential and iconic neighborhoods. It is perfectly perched above Rock Creek Park in Georgetown's East Village. This stately condo building was built in 1942 and has been well-maintained and updated over the years. Gateway Georgetown offers a 24/7 front desk, community laundry, a private community gym, a residents lounge, a wonderful rooftop deck, on-site maintenance and management staff, secure package locker service, and possible garage rental parking or purchase subject to availability from another owner in the building. This condominium is located on a beautiful tree-lined street and is just steps to the heart of Georgetown's shopping, restaurants, and entertainment venues. Dupont Circle is just a short stroll away. Metro Supermarket and Trader Joe's are conveniently located nearby. A Metrobus stop in front of Gateway Georgetown and nearby Dupont Circle Metro provide for easy and carefree transportation around the city and Metro area. Quick and easy access to Rock Creek Parkway make getting out of the city a breeze. Gateway Georgetown provides the perfect city condo for the best of DC living. Features: Updated upper-floor 1-bedroom 1-bath condo home | 887sf of open living space | Filled w/ natural light through-out & beautiful tree views | Gleaming hardwood floors | Welcoming entry foyer w/ a walk-in closet | Open living room & dining room | Built-in bookshelves | Bay window w/ tree views & the perfect home office spot | Updated kitchen w/ granite countertops, glass tile backsplash, & stainless steel appliances | Naturally lit kitchen w/ its own window | Gas cooking | Breakfast bar | Expansive open dining room w/ room for 6-10 diners | Secluded king-size bedroom oasis w/ built-in bookshelves & a walk-in closet w/ custom organization system | Charming well-equipped bathroom w/ a shower/tub, vanity storage, and medicine cabinet storage | Abundant closet & storage space throughout - 5 total closets | Central HVAC | Cats only & certified emotional support or service animals | FHA & VA approved | Condo fee: $890.00 per month includes ALL utilities",Active,36 days,Condo,$890/month,1942,GEORGETOWN,,DCDC2019032,"$379,000",$427,"$378,642",Traditional,38.9103711,-77.0520839,Tiernan Dickens,Washington Redfin Agent,https://www.redfin.com/DC/Washington/2500-Q-St-NW-20007/unit-445/home/9929187,Hyde-Addison Elementary School At Meyer,6,352
"1512 34th St NW,","Washington, DC 20007","$2,995,000",3,3.5,"2,000","Akseizer Residential delivers yet another exquisite showpiece that has been meticulously curated to offer a distinct and unforgettable experience. Featuring a 150' secret and expansive rear garden, 1512 34th St NW is completely renovated with thoughtful design, handcrafted millwork, custom features, and handpicked stone selections. This home is the epitome of sophisticated urban living with its stunning interiors and unbeatable Georgetown location. Complete with 3 Bedrooms and 3.5 Baths throughout approximately 2000 finished square feet, this classic rowhome has maintained its original integrity and charm while being reimagined to suit today’s lifestyle. From the natural rift and quarter-sawn white oak floors to the Shaw English fireclay farm kitchen sink, each design element is intended to create a timeless residence that lives comfortably.",Active,37 days,Townhouse,,1900,GEORGETOWN,"3,055 Sq. Ft.",DCDC2018804,"$2,995,000","$1,498","$2,954,617",Traditional,38.9091255,-77.0680602,Katie Scire,Washington Redfin Agent,https://www.redfin.com/DC/Washington/1512-34th-St-NW-20007/home/9927761,Hyde-Addison Elementary School At Meyer,6,352
"3345 Q St NW,","Washington, DC 20007","$3,200,000",4,4.5,"3,777","OPEN HOUSE SUNDAY (Dec. 5th) 1-3pm!ONE-OF-A-KIND GEORGETOWN LOCATION OVERLOOKING VOLTA PARK. HANDSOME SOUTH-FACING SEMI-DETACHED GEORGIAN BRICK RESIDENCE WITH ELEVATOR, 2-CAR ATTACHED GARAGE, NEW HVAC, RECENTLY PAINTED AND FLOORS REFINISHED, REMODELED KITCHEN AS WELL AS KITCHENETTE ON LOWER LEVEL, LOWER LEVEL WITH OUTSIDE ENTRANCE. TOTAL 4+BEDROOMS, 4.5 BATHROOMS, LIVING ROOM OPENS TO LARGE TERRACE OVERLOOKING THE PARK. GREAT LIGHT THROUGHOUT WITH WINDOWS ON FOUR SIDES OF THE RESIDENCE. A GREAT PLACE FOR ANY COLLECTION OF ART AND FURNITURE WHETHER COLONIAL OR CONTEMPORARY. A MUST SEE!!",Active,39 days,Townhouse,,1935,GEORGETOWN,"1,725 Sq. Ft.",DCDC2018210,"$3,200,000",$847,"$3,109,558",Colonial,38.9108457,-77.0676554,Katie Scire,Washington Redfin Agent,https://www.redfin.com/DC/Washington/3345-Q-St-NW-20007/home/9930509,Hyde-Addison Elementary School At Meyer,6,352
