"516 M St NW #3,","Washington, DC 20001","$1,200,000",3,3,"1,600","Stunning new condo project! This large, 1600sf, 3bd/3ba penthouse unit is located in the ultra convenient Shaw neighborhood and features and exceptional bright and open floor plan; 7"" wide plank engineered wood floors; gourmet kitchen with waterfall island; 2 decks; simply amazing bathrooms; custom lighting details throughout; master w/ walk in closet. This condo is special!",Active,16 days,Condo,$263/month,2021,OLD CITY II,"1,327 Sq. Ft.",DCDC2021050,"$1,200,000",$750,"$1,189,989",Condo/Unit,38.9054366,-77.0196162,Rory Obletz,Washington Redfin Agent,https://www.redfin.com/DC/Washington/516-M-St-NW-20001/unit-3/home/177213230
"57 N St NW Ph 412,","Washington, DC 20001","$714,900",2,1.5,981,"PENTHOUSE RESIDENCE 412 is a luminous and gracious South-facing Jr 2BR/1.5BA Duplex with TWO PRIVATE OUTDOOR SPACES and is located in the Historic Stable that looks out to the charming N Street Row Homes. Inside, you will find a modern galley kitchen that opens to the living and dining area. Accompanied by the private rooftop terrace, a guaranteed extension of living space. Custom Shades will convey and are clearly appreciated in the master bedroom upstairs housing 18' ceilings. 1 Garaged Parking space is optional for purchase at $52,250 (compatible for EV). Bike storage is available for residents in garage and Zone 5 street parking is available for residents. * We welcome you to Chapman Stables , a collection of 114 modern/historic luxury condominiums in the highly desirable Truxton Circle. Chapman is located at the intersection of 1st and N Street in NW DC, in the same building as the local favorite, REPUBLIC CANTINA RESTAURANT. Chapman's modern design reflects the revitalization of the former horse stable, with its unique and custom designs, has given residences custom built-in kitchens and mill work throughout accent walls. Expansive windows and Canadian frameless cabinetry. The amenity-rich, pet-friendly building, with two ELEVATORS, also boasts a common roof terrace with stunning city Capitol and Monument views accompanied by RESTORATION HARDWARE furniture in all common areas.",Active,10 days,Condo,$573/month,2018,OLD CITY II,,DCDC2022206,"$714,900",$729,"$713,885",Contemporary,38.9074434,-77.0111884,Rory Obletz,Washington Redfin Agent,https://www.redfin.com/DC/Washington/57-N-St-NW-20001/unit-412/home/162411918
"516 M St NW #2,","Washington, DC 20001","$660,000",2,2,915,"Stunning new condo project! This gorgeous 2bd/2ba condo is located in the ultra convenient Shaw neighborhood and features and exceptional bright and open floor plan; 7"" wide plank engineered wood floors; gourmet kitchen with waterfall island; simply amazing bathrooms; rear patio. This condo is special!",Active,16 days,Condo,$197/month,2021,OLD CITY II,"1,327 Sq. Ft.",DCDC2021060,"$660,000",$721,"$658,564",Condo/Unit,38.9054366,-77.0196162,Rory Obletz,Washington Redfin Agent,https://www.redfin.com/DC/Washington/516-M-St-NW-20001/unit-2/home/177213252
"920 I St NW #715,","Washington, DC 20001","$2,399,000",2,2,"1,567","Downtown living at its absolute best! NEW PRICE! Welcome to City Center Unit #715. This two bedroom, two bathroom home is simply stunning! The morning sunlight fills every room with floor to ceiling glass windows. Entertain guests on a massive outdoor deck which is a true rarity downtown. This home is like no other in City Center. The sellers have gone to great expense to improve the kitchen, bathrooms, and the primary bedroom suite. Both bedrooms offer a wonderful shared outdoor deck that overlooks the beautiful cityscape below. Another huge bonus is the two parking places that are included with Unit #715. Both spaces are side-by-side and are positioned closest to the elevator. Additional storage is also included.",Active,4 days,Condo,"$2,200/month",2013,CENTRAL,,DCDC2018484,"$2,399,000","$1,531","$2,357,106",Contemporary,38.9006958,-77.0245066,Rory Obletz,Washington Redfin Agent,https://www.redfin.com/DC/Washington/920-I-St-NW-20001/unit-715/home/55187069,Thomson Elementary School,6,331
"1740 New Jersey Ave NW #4,","Washington, DC 20001","$589,000",2,2,730,"Make sure that you experience the 3D Virtual Tour Link. Don’t miss a rare opportunity to join this sophisticated boutique 6 unit 2016 condo conversion, constructed with the finest expert craftsmanship. The location is unbeatable! Enjoy your 97 walk score at the intersection of LeDroit Park, Bloomingdale and Shaw neighborhoods. 5 minute walk to the Shaw- Howard U Metro Station. Sun drenched condo with oversized windows. Rich toned hardwood flooring throughout. Very low condo fee. Open floor plan w/ high ceilings. In-unit washer and dryer. Rooftop deck with 360 city view provides a great place to unwind, working from home, or BBQ with friends. Enjoy sweeping city, Capitol, and Monument views. HOLY KITCHEN BATMAN!!! Or, you could entertain while you cook in your new open concept gourmet kitchen, complete with quartz counters, tile backsplash and high end stainless steel appliances. Did I mention the LED under cabinet lighting? Large storage locker in the basement with a bike rack.",Active,7 days,Condo,$269/month,1921,OLD CITY II,,DCDC2021422,"$589,000",$807,"$588,330",Art Deco,38.9138801,-77.0181905,Rory Obletz,Washington Redfin Agent,https://www.redfin.com/DC/Washington/1740-New-Jersey-Ave-NW-20001/unit-4/home/105495170,Cleveland Elementary School,5,304
"440 L St NW #105,","Washington, DC 20001","$475,000",1,1.5,800,"UNIQUE feels very spacious DUPLEX with 10 1/2 foot ceiling on main level and wall of windows with indirect north natural light. Bedroom level is larger than main living space, as it is over the lobby (see floor plans in photos. ) Gas cooking! Brand new Luxury Vinyl flooring throughout unit (NO CARPET!) Powder room on main level. Washer/dryer on bedroom level. Walk In closet, big full bathroom with tub. High amenity and secure pet friendly building with Concierge, numerous common areas including library directly next to unit, huge courtyard, TWO roof decks, Shared amenities with The K at City Vista include hot tub (open in winter) and pool. DEEDED Garage parking with easy elevator access. Secure covered bike storage in garage. On same block as grocery store (full size Safeway), Sweet Green, numerous restaurants, Vida Fitness (ask about resident discount). Easy stroll to Chinatown, Cap One Arena, City Center luxury shopping, museums! Metro access within blocks at Convention Center. Square footage is approximate and based on floor plan measurements, which place the total square footage above 800 sq feet.",Active,3 hours,Condo,$582/month,2007,OLD CITY II,,DCDC2022760,"$475,000",$594,"$475,189","Split Level, Condo/Unit, Bilevel, Contemporary",38.9036074,-77.0173868,Rory Obletz,Washington Redfin Agent,https://www.redfin.com/DC/Washington/440-L-St-NW-20001/unit-105/home/12533563,Walker-Jones Education Campus,3,384
"757 Harvard St NW,","Washington, DC 20001","$719,000",3,2.5,"1,120","Fantastic opportunity on this bright, updated, and turn-key classic Columbia Heights rowhouse on picturesque tree-lined Harvard St! Property features an open main level floor plan w/ brand new kitchen cabinetry, quartz countertops, and stainless steel appliances. Two brand new full baths w/ additional rare main level quarter bath have been thoughtfully designed by the sellers. Bamboo flooring across main level is complemented by soft-touch cork flooring upstairs and brand new carpeting on lower level, and windows and entry doors have been replaced throughout! The spacious fully finished basement contains * great * usable space, and off the main level this home opens out onto a private tiered deck w/ patio. The unique location on Harvard has the home backing up directly to community green space, keeping things open, sunny, and private in back. Multiple shops, grocery, and dining options all within quick walking distance (Walk Score 94), and the shops/dining of 14th St, Georgia Ave, and U St are all just a few blocks away!! Unbelievable value for the location and condition to OWN your own home in comparison to nearby Columbia Heights condo options",Active,6 hours,Townhouse,,1940,COLUMBIA HEIGHTS,800 Sq. Ft.,DCDC2023168,"$719,000",$642,,Federal,38.9270854,-77.0249276,Rory Obletz,Washington Redfin Agent,https://www.redfin.com/DC/Washington/757-Harvard-St-NW-20001/home/10032198,Tubman Elementary School,4,548
"424 M St NW #7,","Washington, DC 20001","$750,000",2,2,908,"Open Sun. Dec. 5th, 1:00 - 3:00. New construction, 2-level penthouse condo features two huge private outdoor spaces. The main level balcony has floor-to-ceiling, fully retractable glass doors providing an indoor/outdoor feel for the living room. The second floor features the primary bedroom suite with a luxury bathroom, walk-in closet and the second huge outdoor space. 1 parking space available for $35K. 424 M Street NW is a new 8-unit development by Bloom Residential. 50% of the units are under contract or sold and the condos are ready for immediate settlement and occupancy.",Active,6 hours,Condo,$333/month,2021,OLD CITY II,,DCDC2023220,"$750,000",$826,"$750,255",Condo/Unit,38.905353,-77.01722,Rory Obletz,Washington Redfin Agent,https://www.redfin.com/DC/Washington/424-M-St-NW-20001/unit-7/home/176996406,Walker-Jones Education Campus,3,384
"216 Rhode Island Ave NW,","Washington, DC 20001","$999,555",4,3.5,"2,298","City living at its best! Historic charm and modern updates mesh seamlessly in this light-filled rowhome located in convenient Bloomingdale. The gracious foyer with its tin ceiling welcomes you into the home where you'll feel the warmth of the sun bouncing off of the refinished hardwood floors. The extra large living room allows space for two separate seating areas and leads you into the light-filled dining room. The dining room is separated from the kitchen by a huge, quartz-topped peninsula that offers storage, prep space, and serving space. The stainless steel appliances are newer and the cabinets and floors are finished in a cool and classic gray. A large powder room with laundry complete the first floor. The upstairs bedroom level is a bright retreat that provides a King-sized primary bedroom with renovated en-suite bath plus a door to a balcony over the front porch. The primary suite includes two large closets as well. The guest bedroom also accommodates a king-sized bed while a third bedroom makes the ideal office, nursery, or Peloton space. The fully finished basement with kitchen, bath, and laundry has both front and rear entrances allowing it to be an ideal rental covering half your mortgage or an Airbnb. Your tenants will appreciate the easy walk to nearby restaurants like The Red Hen, coffee shops like Big Bear, and the Shaw/ Howard Metro. Though street parking is easy to find, you won't have to worry about that as there is a large parking pad in the rear of the home.",Active,9 hours,Townhouse,,1911,ECKINGTON,"1,276 Sq. Ft.",DCDC2023158,"$999,555",$435,"$1,000,987",,38.914492,-77.014863,Rory Obletz,Washington Redfin Agent,https://www.redfin.com/DC/Washington/216-Rhode-Island-Ave-NW-20001/home/10046605,Langley Elementary School,4,290
"459 Massachusetts Ave NW #24,","Washington, DC 20001","$499,900",1,1,653,"Introducing, The Anne. Now selling in the Mount Vernon Neighborhood. We are a boutique - brand new condo community in the prime downtown location. Where historic features meets modern convenience. A rare opportunity to own in a location central to everything this city has to offer. Don't miss out - only 15 charming residences remain. Delivery is anticipated within 30 days.",Active,9 hours,Condo,$293/month,,MOUNT VERNON,,DCDC2023166,"$499,900",$766,"$499,927",Colonial,38.9011073,-77.0180235,Rory Obletz,Washington Redfin Agent,https://www.redfin.com/DC/Washington/459-Massachusetts-Ave-NW-20001/unit-24/home/177473567,Walker-Jones Education Campus,3,384
"2920 Georgia Ave NW #107,","Washington, DC 20001","$430,000",1,1,552,"This gorgeous contemporary light-filled 1BR/1BA condo has everything you need & upscale design touches that will make you happy to call this home. The open layout & huge windows make the space warm & welcoming in addition to the beautiful design features including wide plank hardwood flooring & recessed lighting throughout. The kitchen features quartz countertops, KitchenAid stainless steel appliances w/ vented microwave, soft-close modern flat panel cabinets w/ under cabinet lighting and an island with seating & plenty of counter space for creating dining delights. The kitchen leads to the large dining/living room with plenty of space for relaxing and enjoying delicious meals. The large bedroom with floor to ceiling windows has a stunning & unique textured concrete accent wall, ample closet space & an en-suite bathroom with a floating quartz vanity & more storage. Wired for fiber optics, the condo also comes with a programmable Nest thermostat & smart lighting switches throughout. Lots of storage & full sized front loading washer & dryer in the condo. Secure underground oversized garage parking space has extra room for storage. The condo building has a rooftop terrace w/ plush seating & dining space so that you can enjoy the gorgeous views w/ your cocktails. There is also an intimate ground floor open courtyard steps away from your front door & there are outdoor grills for cookouts, an elevator and secured bike rack storage in the underground garage. Everything you could need & more! Phenomenal location in this exciting Park View neighborhood with NuVegan restaurant & Bravo bar just outside your front door & it is an easy walk to two of the DC's best beer gardens - Midlands Beer Garden & Hook Hall. Also, walk to Call your Mother Deli, Whole Foods, Sonny’s Pizza, Tabla DC, Doubles DC (coffee ping pong and patio), Atlantic Plumbing Building, Target, Best Buy & much more. .. For all of your recreation needs, Bruce Monroe Park & Banneker Park and Pool are also located right next door. If you need to hop downtown or out to the burbs, both Columbia Heights & Georgia-Petworth metro stations are located within walking distance. Walk Score=96. Stop by the open house on Saturday, 12/4, between 1-4pm.",Active,34 hours,Condo,$431/month,2014,COLUMBIA HEIGHTS,,DCDC2022420,"$430,000",$779,"$429,947",Contemporary,38.9277468,-77.023409,Rory Obletz,Washington Redfin Agent,https://www.redfin.com/DC/Washington/2920-Georgia-Ave-NW-20001/unit-107/home/64852149,Tubman Elementary School,4,548
"1408 9th St NW,","Washington, DC 20001","$1,000,000",—,—,"1,800","MULTI-UNIT OPPORTUNITY IN INCREDIBLE LOCATION!!!! Welcome to 1408 9th Street NW, a 3-Unit building with commercial and residential space literally in the middle of it all. One block to the east is the City Market at O. Shaw/ Howard U Metro is 5 blocks to the north with amazing bars and restaurants such as Zeppelin, Chaplin’s, and Dacha Café. Logan Circle is 3 blocks to the west along with the Shaw Skate Park and Cardozo Playground to satisfy your playful side. Venture just a few blocks south to the Washington Convention Center and you are flush with restaurants like Unconventional Diner and an amazing local bar scene featuring Maxwell, Lost and Found and Tallboy. With favorable MU-4 mixed-use zoning, this building provides a tremendous opportunity to a savvy buyer. The first floor is currently used as a commercial space for a dog-grooming business. The 2nd floor and 3rd floor are each individual, one-bedroom apartments which are currently vacant. This a tremendous opportunity for an investor to buy a prime location that is still growing or an owner occupant to live in one unit and rent the other two. Certificate of Occupancies are available for all 3 units. Additional details including the floor plans are available in the Offering Memorandum. SHOWING NOTE: DO NOT ACCESS MAIN FLOOR UNIT. Main floor commercial space is not available for showings during the hours of 9:30 am through 8:00 pm and confirmed with Listing Agent. Residential units may be scheduled at anytime through ShowingTime.",Active,2 days,Multi-Family (2-4 Unit),,1900,OLD CITY II,600 Sq. Ft.,DCDC2022156,"$1,000,000",$556,"$995,608",Traditional,38.9089317,-77.0241287,Rory Obletz,Washington Redfin Agent,https://www.redfin.com/DC/Washington/1408-9th-St-NW-20001/home/9877716,Seaton Elementary School,8,390
"144 S St NW,","Washington, DC 20001","$1,299,900",4,4.5,"2,200","144 S Street NW is a 2,100 + square foot, four bedroom four bathroom modern interpretation of a classic Bloomingdale row home. Elements include 10 foot ceilings, floor to ceiling walls of beautiful glass, an in-wall built-in Sonos whole home audio system, sleek stone and tile surfaces. The elegant kitchen features Bosh and Fulgor Milano appliances. The 3rd floor features a den with built in wet bar and wine fridge that connects to a private roof deck with sweeping views, of DC and MD. The lower level rentable one bedroom in-law suite has two entrances and large bedroom and bathroom. The residence comes with a private covered parking space. Ask listing agent about buyer incentives.",Active,10 days,Townhouse,$128/month,2021,BLOOMINGDALE,1 Sq. Ft.,DCDC2019602,"$1,299,900",$591,"$1,300,098",Contemporary,38.913864,-77.013625,Rory Obletz,Washington Redfin Agent,https://www.redfin.com/DC/Washington/144-S-St-NW-20001/home/171549911,Langley Elementary School,4,290
"1737 11th NW #200,","Washington, DC 20001","$1,400,000",3,3.5,"2,400","American Architect William Stulz, known for the design of many of The District’s churches, created 1737 11th Street NW in 1899. President William McKinley was serving his term and the Spanish-American war had just ended. This grand 4 story rowhouse stands at the crossroads of where Logan meets the Shaw Neighborhood. Just a couple blocks to the north, you will find U Street Corridor, which historically was known as “Black Broadway” where in the early 20th-century acts like Cab Calloway and Pearl Bailey once played. The collaboration of the 3 neighborhoods have a few things in common: Shopping, Dining, Parks, Public Transportation, and Music Venues. Welcome to The Lofton at Logan. Today, this grand piece of architecture has become a unique structure containing two fully-renovated, four-level, pristine condominiums by R Street Development and Harbor Builders. Each of the townhome-style condos feature 3-bedrooms + den, 3.5 -bathrooms, plus additional flexible living space spanning over 2,000+ SQFT. Enjoy entertaining on the rooftop decks, which are grandfathered a full story above the neighbors, with views of the Washington Monument and National Cathedral. Featuring custom finishes including Quartz countertops, Porcelanosa tile and White Oak flooring and custom gourmet kitchens which include Thermador and Bosch appliances. Unit #100 features historic Victorian-style Bay windows overlooking the tree-lined views of the newly renovated, Garrison Elementary, while Unit #200 boasts gorgeous living/dining space that is sun-lit by two levels of picture windows and private parking! Enjoy the quiet neighborhood feel while still living just a few blocks from the acclaimed restaurants of the 14th Street Corridor, Metro, Entertainment, Dog Parks, Coffee Shops, and retail. Buy as one, or purchase each unit separately. Condo paperwork onhand if sold individually. Live in one, and rent the other.",Active,3 days,Townhouse,$250/month,1900,LOGAN CIRCLE,,DCDC2000327,"$1,400,000",$583,"$1,401,625","Transitional, Victorian",38.9136454,-77.0267041,Rory Obletz,Washington Redfin Agent,https://www.redfin.com/DC/Washington/1737-11th-St-NW-20001/unit-200/home/174610669,Garrison Elementary School,9,277
"29 Q St NW,","Washington, DC 20001","$1,175,000",4,3.5,"2,313","YES, YOU CAN HAVE IT ALL! Built in 1900 and located in Truxton Circle on a tree-lined, one-way street adjacent to Bloomingdale, this gorgeous 2-unit home features 2313 finished square feet of upscale living and an open floorplan filled with hardwood floors and exposed brick walls, and flooded with light. This location boasts a Walk Score of 96, a Bike Score of 91, access to 3 Metro stops, and close proximity to Union Market, multiple parks and playgrounds, and the Harry Thomas Recreation Center and pool. Enjoy entertaining with a gas fireplace, a wall of incredible built-ins, a wine refrigerator, recessed lighting, and a tray ceiling in the open living/dining area. The gourmet kitchen features a Smeg 5-burner range with hood, custom cabinetry, open shelving with accent lighting, and granite counters. Nearby is a convenient half bath. Upstairs there is a primary bedroom with huge closet, en suite bath with stall shower, and adjacent stacked, front-loading washer and dryer. Two additional bedrooms and a full bath are located down the hall. The rear bedroom contains a Murphy bed that will convey with the house. An upper deck is located off that bedroom and from there, you can access the 400 SF roof terrace with beautiful city views via a space-saving circular staircase. The lower level has independent access and has previously been granted a certificate of occupancy. There you will find the 700+ SF one bedroom unit with den, a galley kitchen, and a full bath with slate tile. A mid-size parking pad is located off the rear alley secured by an overhead door. The sellers have taken great care of this contemporary home, replacing two HVAC systems, installing a tankless water heater, updating appliances, and painting inside and out. Come see for yourself and make it yours in time to celebrate the new year.",Active,4 days,Townhouse,,1900,OLD CITY II,"1,122 Sq. Ft.",DCDC514598,"$1,175,000",$508,"$1,177,152",Victorian,38.911332,-77.011364,Rory Obletz,Washington Redfin Agent,https://www.redfin.com/DC/Washington/29-Q-St-NW-20001/home/11743779,Seaton Elementary School,8,390
"430 M St NW #6,","Washington, DC 20001","$439,900",1,1,508,"Amazing investment opportunity!! Available fully furnished! Gorgeous 1 bed, 1 bath condo in highly sought after Mount Vernon Square with a low fee & a separately deeded off-street parking spot available for purchase! This charming unit offers large new windows, 9 ft ceilings, recessed lighting, hardwood floors, recessed speaker system, and ample storage throughout. The fully-equipped kitchen features stainless steel appliances, stone countertops, beautiful tile backsplash, and customized cabinetry. Access the private balcony through the sun-soaked main bedroom. Take advantage of your balcony and use to enjoy your morning coffee, read a good book or to take in the fresh air. The in-unit washer and dryer are hidden out of sight. The boutique building is in close proximity to countless dining, nightlife and shopping options. Favorites include A Baked Joint, Prost, RPM Italian, and more! Transportation made easy with access to the Mount Vernon Metro Station. Building is pet friendly! Don't miss out on the private courtyard with two grills - perfect for entertaining guests. Separately deeded off-street parking spot in the back of building available for $40K. All square footage and dimensions, though compiled from sources deemed reliable, are estimates.",Active,3 days,Condo,$202/month,1894,OLD CITY II,,DCDC2022628,"$439,900",$866,"$440,289",Federal,38.9055054,-77.0174772,Rory Obletz,Washington Redfin Agent,https://www.redfin.com/DC/Washington/430-M-St-NW-20001/unit-6/home/55187293,Walker-Jones Education Campus,3,384
"912 U St NW #505,","Washington, DC 20001","$539,900",1,1,660,"Amazing Washington Monument, Capitol Dome and City-scape views! Perfect one bedroom with balcony and a lots of glass in the heart of Shaw! Adjacent to the metro and everything U St has to offer. Quiet location and southern exposure. Special features include hardwood throughout, built-in desk, Silestone solid quartz countertops, porcelain tile kitchen backsplash, Kohler kitchen and bathroom fixtures, Nest thermostat comfort control, secured access and key fob building entry, Energy Star, certified stainless steel appliances, solid core wood doors, low-e insulated windows, nine-foot ceilings, Elfa storage system closets, under-cabinet lighting, full-sized, front-loading washers and dryers, modern framed bathroom mirrors, American-made solid wood cabinetry, and honed Carrara marble bathroom flooring.",Active,5 days,Condo,$321/month,2021,SHAW,,DCDC2022458,"$539,900",$818,,"Contemporary, Condo/Unit",38.9167496,-77.0245532,Rory Obletz,Washington Redfin Agent,https://www.redfin.com/DC/Washington/912-U-St-NW-20001/unit-505/home/177347222,Garrison Elementary School,9,277
"912 U St NW #401,","Washington, DC 20001","$499,900",1,1,615,"Amazing Washington Monument and City-scape views! Perfect one bedroom with balcony and a wall of glass in the heart of Shaw! Adjacent to the metro and everything U St has to offer. Quiet location and southern exposure. Special features include hardwood throughout, Silestone solid quartz countertops, porcelain tile kitchen backsplash, Kohler kitchen and bathroom fixtures, Nest thermostat comfort control, secured access and key fob building entry, Energy Star, certified stainless steel appliances, solid core wood doors, low-e insulated windows, nine-foot ceilings, Elfa storage system closets, under-cabinet lighting, full-sized, front-loading washers and dryers, modern framed bathroom mirrors, American-made solid wood cabinetry, and honed Carrara marble bathroom flooring.",Active,5 days,Condo,$299/month,2021,SHAW,,DCDC2022456,"$499,900",$813,,"Contemporary, Condo/Unit",38.9167496,-77.0245532,Rory Obletz,Washington Redfin Agent,https://www.redfin.com/DC/Washington/912-U-St-NW-20001/unit-401/home/177347217,Garrison Elementary School,9,277
