"1367 K St SE #203,","Washington, DC 20003","$295,000",1,1,466,"PRICED TO SELL! If you’re seeking affordable homeownership under $300,000 in a sought-after DC neighborhood, look no further! This sun-filled one bedroom overlooks the quaint, Capitol Hill charm of K Street and is located less than two blocks from all things essential to DC living (metro, grocery, social hotspots: you name it!). The smart layout of the unit offers a nice flow, allowing modest square footage to punch above its weight. The kitchen and dining/living spaces are flooded with natural light from three large, second-floor windows. The kitchen is equipped with updated stainless steel appliances, granite countertops, and marble cabinetry. With the stove-top/oven positioned beneath the window, it's quite a treat to cook while enjoying your Capitol Hill view! The kitchen and living areas are separated from the sleeping quarters. The bedroom windows overlook the condo community's private patio and garden, providing privacy and quiet. Renovated bathroom offers marble and glass shower doors. The brand new, in-unit washer/dryer combo offers convenience and the common laundry facilities are available for larger loads. It is a pet-friendly building with brand new common area flooring. This address has a walk score of 90! You are blocks away from Potomac Ave metro (orange, blue, and silver lines), supermarkets Harris Teeter, Safeway, Whole Foods, and Trader Joe's, and hang-out spots like Barracks Row, Eastern Market, and Navy Yard. Walk across the street to The Roost and choose from dozens of dining and shopping options. Easy access to 695/395/295 highways.",Active,74 days,Condo,$314/month,1946,OLD CITY I,,DCDC2014978,"$295,000",$633,"$291,758",Colonial,38.8782167,-76.9859293,Rory Obletz,Washington Redfin Agent,https://www.redfin.com/DC/Washington/1367-K-St-SE-20003/unit-203/home/9915660,Tyler Elementary School,7,512
"1330 K St SE #1,","Washington, DC 20003","$995,000",3,2.5,"2,346","Searching for the SIZE of a grand home but the convenience of a condo? Schmidt Development has designed and delivered the BEAUTIFUL BALANCE of your dreams! EXTRA LARGE condo residence is perfectly placed just steps to Metro, groceries, eats, and entertainment. Welcoming front porch overlooking K Street with large rooftop deck at the rear. Broad and spacious living areas with great flow and open floor plan across two levels. Three BIG bedrooms and 2.5 bathrooms. Luxurious Carrara marble in bathrooms and stunning demonstration kitchen with custom cabinets and curated collection of best-in-class appliances. Every detail carefully constructed and masterfully executed! Ask about deeded parking for sale. Contact us for SAFE private showing!",Active,77 days,Townhouse,$200/month,2021,CAPITOL HILL,,DCDC2014300,"$995,000",$424,"$983,388","Craftsman, Contemporary",38.8785811,-76.9872914,Rory Obletz,Washington Redfin Agent,https://www.redfin.com/DC/Washington/1330-K-St-SE-20003/unit-1/home/176443107,Tyler Elementary School,7,512
"1330 K St SE #2,","Washington, DC 20003","$1,099,000",3,3.5,"2,075","Searching for the SIZE of a grand home but the convenience of a condo? Schmidt Development has designed and delivered the BEAUTIFUL BALANCE of your dreams! EXTRA LARGE condo residence is perfectly placed just steps to Metro, groceries, eats, and entertainment. Welcoming front porch overlooking K Street with large rooftop deck at the rear. Broad and spacious living areas with great flow and open floor plan across two levels. Three BIG bedrooms and 3.5 bathrooms. Luxurious Carrara marble in bathrooms and stunning demonstration kitchen with custom cabinets and curated collection of best-in-class appliances. Every detail carefully constructed and masterfully executed! Ask about deeded parking for sale. Contact us for SAFE Private showing",Active,78 days,Townhouse,$200/month,2021,CAPITOL HILL,,DCDC2014308,"$1,099,000",$530,"$1,082,537",Craftsman,38.8785811,-76.9872914,Rory Obletz,Washington Redfin Agent,https://www.redfin.com/DC/Washington/1330-K-St-SE-20003/unit-2/home/176441739,Tyler Elementary School,7,512
"1211 Van St SE #609,","Washington, DC 20003","$449,000",1,1,645,"Here is a residential opportunity to own a piece of the Capitol Riverfront and join a community living their best lives. This one-bedroom condo transcends modern luxury featuring a smart open floor plan that is bright and airy with amazing views. * Expansive lobby with varied seating * Dog Park and Pet Spa * Lobby Drink Bar Area * Pool Table * Roaming Concierge. * Lobby Fireplace, Billiards * Wi-Fi * Fitness Center * Rooftop Terrace with Swimming Pool. * Rooftop Outdoor Seating Features Three Fire Pits * Lounge * Indoor Rooftop club lounge * Secure Bicycle Parking. * Secure Bicycle Maintenance Station * Zen Garden & Courtyard. Please note, the unit has been virtually staged. Corporate Relocation.",Active,79 days,Condo,$409/month,2017,OLD CITY I,,DCDC2010836,"$449,000",$696,"$445,820",Contemporary,38.8758567,-77.0085659,Rory Obletz,Washington Redfin Agent,https://www.redfin.com/DC/Washington/1211-Van-St-SE-20003/unit-609/home/170049135,High Road Middle School of Washington,7,-
"1235 K St SE,","Washington, DC 20003","$715,000",2,1,"1,020","Incredible Capitol Hill Townhome available for sale. This two-bed one bath residence is a perfect blend of Federalist architecture and modern soaring open space. The artisan hand crafted metal fencing houses a simple organic front yard with mature plantings. The Front entrance door leads you to front den and wood burning fireplace with built in book cases and hidden broom closet and hanging television mount. The nine-foot ceiling height accentuates the tasteful paint colors, and the exposed two-story exposed brick wall and interior atrium that floods the space with natural light. Custom hanging systems make picture changes and seasonal art a breeze to swap. Dark stained hardwood floors throughout add to the charm. Dining space hear the exposed stairs lead to the custom upgraded kitchen with stainless appliances and granite counters and all wood cabinetry. Wireless blue tooth enabled speakers set the tone. Access to the rear brick patio is through the kitchen and down the rebuilt Trex stairs. A 10-foot custom open gazebo keeps the elements out and provides an outdoor living room compete with lighting and a fountain water feature to extend the evening when weather permits. Upstairs is a well-spaced master bedroom with double closets and an additional rear bedroom. The main bath features custom ceramic tiles and a soaking tub. Not all the wonders are readily apparent. The entire home was repointed on the exterior, and professionally painted inside and out. The entire roof top high efficiency natural gas forced air furnace and air conditioning was replaced in July with a new higher efficiency system. Double Therma-pane windows add additional comfort to the home. The mansard attic provides additional storage space and roof access. The location is accessible to nearly everything on the Hill; the metro, Harris Teeter, restaurants, parks and The Capitol grounds. An incredible first home, DC in town residence and an excellent condo alternative with private spaces and a front door address. A great opportunity waiting for the right buyer.",Active,84 days,Townhouse,,1925,OLD CITY I,771 Sq. Ft.,DCDC2013206,"$715,000",$701,"$700,830",Federal,38.8782549,-76.9890239,Rory Obletz,Washington Redfin Agent,https://www.redfin.com/DC/Washington/1235-K-St-SE-20003/home/9912222,Tyler Elementary School,7,512
"70 N St SE #816,","Washington, DC 20003","$454,900",1,1,576,"Fall Special: $10,000 towards closing costs for purchases before 12/15/21 and when using 1 of designated lenders and RGS Title. eNvy is ready to move-in. Enjoy professional baseball and soccer plus the myriad new restaurants and retail moving to this hot, fun area. Retail at street level at eNvy includes: Chicken & Whiskey, Kilwin's confectionary and 99 Taphouse. It's less than 1 block to Metro. Views to Nats Park (and the river) from roof top terrace. Roof-top w/ grills, TVs, lots of seating and resident's lounge. 2-story lobby with library, concierge, waiting lounge and conference table. Pool membership available. 1BR condo features include: hardwood thru-out, marble & limestone in baths. Kitchens: Bosch appliances, Silestone counters, 42"" gloss white cabinets. Meko shades included.",Active,75 days,Condo,$314/month,2020,OLD CITY I,,DCDC2014690,"$454,900",$790,"$454,612",,38.8748381,-77.0068654,Rory Obletz,Washington Redfin Agent,https://www.redfin.com/DC/Washington/70-N-St-SE-20003/unit-816/home/176474905,"High Road Primary Academy of Washington, Dc",7,-
"226 Kentucky Ave SE Unit C-4,","Washington, DC 20003","$879,000",3,2.5,"1,660","Only-1 Remaining. . Almost Sold-Out. .. Hurry, , One Condo Remaining! HURRY * * Chic Urban Residences, Set in an Intimate 4-Unit Townhome Style Boutique Condo Building, Aptly Named "" THE REID"" * The Condo - Townhome ""HYBRID"" Boast Two- Models, w/ Impeccable interior finishes, that is certain to please the most demanding buyer. * The Chateau Model, Upper Level Condo Units 3 & 4 Features 3 Bedrooms 2 Full Baths and 1 HB * an Elegant, Urban City-Sleek Floor Plan, equally as Charming w/ Luxurious Appointments which also creates a Modern & Timeless place for both Relaxation, and Entertaining! Enter the Sun-filled Model on the Second Level, into a Classy finished Interior, with Tall Open Windows, Oak Plank Lauzon Hardwood Floors, Impeccable finishes, such as Custom Paneled Wood Walls, w/ Closet Space and Storage * Gourmet Kitchens in each unit are Paired with Italian White Quarts Counter-Tops, Huge Island, w/ Water-Falls, Solid Wood Cabinetry featuring Custom Recess lighting * Stainless Steel Appliances with Gas Cooking * Washer & Dryer * Long Sleek Hallways, Custom Painted, which leads to a 2nd back Entry, and an Open 7"" Stairwell to the Upper Level. Upper Level Features, 3 Open Rooms to be Utilized to your Hearts Desire and Imagination, with Open Access to a Massive Custom Tiled, Roof-Top Deck, with Amazing Views! * The Chateau Model also features a Sleek Spacious Balcony, for Relaxing and Entertaining which Opens and Overlooks the Backyard. All of this and soo much more in a Pet Friendly Boutique Building with Low fees!! Walk 5 minutes to the Amazing Brand new Safeway, 10 minutes to Eastern Market, and the Eastern Market Metro, Capitol Hill Parks, Restaurants and Shops. . Superb Location. Alarm Codes are in Showing-time messages. Bring Seller an Offer!",Active,88 days,Townhouse,$246/month,2021,OLD CITY I,,DCDC2012328,"$879,000",$530,"$879,402","Art Deco, Beaux Arts, Bilevel, Contemporary",38.8869488,-76.9875502,Rory Obletz,Washington Redfin Agent,https://www.redfin.com/DC/Washington/226-Kentucky-Ave-SE-20003/unit-C-4/home/176330120,Payne Elementary School,8,346
"1300 4th St SE #603,","Washington, DC 20003","$900,000",2,2,"1,050","Welcome Home to the Luxurious Bower in the Heart of Navy Yard! Built in 2019, this two bedroom, two bath condo boasts wide plank hardwood flooring and floor-to-ceiling windows flooding the space with natural light. With over 1000 sqft, not including the large private balcony with water views, the spacious floor plan allows for ample living space and a dining area. The gourmet kitchen features Bosch appliances, quartz counters, and high-end Italian cabinetry. The primary bedroom includes an en suite with modern fixtures and a walk-in closet with custom built-in shelving. Off of the main living area you’ll find the second bedroom, which can fit a large bed or be used as the perfect office for your WFH needs. Parking included!! Building amenities include a 24/7 concierge, fitness center, and a rooftop terrace with a grill and some of the most spectacular views in DC. Right out the front door you are surrounded by some of the hottest restaurants and nightlife DC has to offer!",Active,93 days,Condo,$976/month,2018,WASHINGTON NAVY YARD,,DCDC2011164,"$900,000",$857,"$881,820",Contemporary,38.8746658,-77.0001717,Rory Obletz,Washington Redfin Agent,https://www.redfin.com/DC/Washington/1300-4th-St-SE-20003/unit-603/home/160755760,Eagle Academy Public Charter School - Capitol Riverfront,6,156
"207 3rd St SE,","Washington, DC 20003","$2,050,000",—,—,"4,406","Developers/Investors Alert! 6 unit condo can be built under grand father certificate of occupancy Close to Capitol Hill, Library of Congress, Metro, entertainment etc. Walk Score 95 and Bike Score 97. This gem is located at the heart of Capitol Hill. Interior Demo completed including asbestos and LBP as per EPA and DDOE regulations.",Active,85 days,Townhouse,,1890,CAPITOL HILL,"2,124 Sq. Ft.",DCDC2013044,"$2,050,000",$465,"$3,245,988",Colonial,38.8865994,-77.0023191,Rory Obletz,Washington Redfin Agent,https://www.redfin.com/DC/Washington/207-3rd-St-SE-20003/home/9891871,Brent Elementary School,8,432
"337 Kentucky Ave SE,","Washington, DC 20003","$969,900",2,1,"1,072","Come see this wonderful rowhome in sought after Kentucky Ave, Capitol Hill! Perfectly situated between Lincoln Park and Pennsylvania Ave, this home boasts 2 bedrooms + Den/Office space with a full bathroom on the upper level. There is plumbing in the basement that can allow for an additional bathroom and additional living space. Main level is open with both living and dining flowing into the kitchen in the rear. There is an unusable car port in the back yard that can be renovated along with a deck, and patio for lounging. Footsteps from Safeway, retail, the Potomac Ave Metrorail and bus stations. Accessible to 295 via Pennsylvania Ave. With a little bit of elbow grease this house can be like new!",Active,109 days,Townhouse,,1925,OLD CITY I,"1,280 Sq. Ft.",DCDC2009436,"$969,900",$905,"$945,716",Federal,38.8845174,-76.9861889,Rory Obletz,Washington Redfin Agent,https://www.redfin.com/DC/Washington/337-Kentucky-Ave-SE-20003/home/9914878,Watkins Elementary School (capitol Hill Cluster),7,444
"70 N St SE #413,","Washington, DC 20003","$889,900",2,2,"1,182","Ask about our $10,000 closing costs special for all sales by 12/15/21! MODEL HOME - PRICE INCLUDES FURNITURE AND DECOR BY Akseizer Design Group. South facing w/ lots of floor-to-ceiling windows in the MBR and the living area. Kitchen includes ample storage space plus Bosch appliances, gas cooking, Silestone countertops, gloss white cabinets. Baths include linen storage as well as marble/tile floors. Hardwood throughout. Enjoy amenities including a roof top deck w/ views of Nats Park and the rivers, grills, ample seating and an outdoor TV. Indoor/outdoor owner's lounge includes shuffle board, refrigerator, icemaker, and room for fun. Other building features include a fitness center, Zen garden w/ firepit and fountain, a fitness center and 16-hour a day concierge. Ask for information on joining the pool which is accessible from the rooftop. Garage parking available at additional charge. Live close to everything the Navy Yard has to offer. New restaurants at eNvy include Silver Diner, Chicken and Whiskey, Kilwins (a confectioner) and 99 Tap House. Many other new restaurants are open/opening over the course of 2021 and are located just around the corner on Half Street, joining the myriad other options throughout the neighborhood. Navy Yard is a great neighborhood known for professional sports and fun! Metro is within a block. Or walk to work at Navy Yard, DOT or Capitol Hill. Short hop to National Airport and Amazon HQ. Can't beat the convenience of this location.",Active,106 days,Condo,$641/month,2020,OLD CITY I,,DCDC2009908,"$889,900",$753,"$889,453",Transitional,38.874779,-77.0079074,Rory Obletz,Washington Redfin Agent,https://www.redfin.com/DC/Washington/70-N-St-SE-20024/unit-413/home/167115021,"High Road Primary Academy of Washington, Dc",7,-
"242 14th St SE Unit B,","Washington, DC 20003","$989,900",3,2.5,"1,713","Owners says sell!!! Huge price drop and ready to move in, just in time for the holidays, in this elegant contemporary townhouse in historic and beautiful Capitol Hill! With precision construction, this dynamic home is perfect for the working professional, or growing family. This one-of-a-kind builder owned home offers off-street parking, chic finishes, grand views of the Nation’s Capital, and the privacy of an urban private getaway. The home sports an owner’s suite with two spacious closets, including a walk-in, bathed in natural sun light, an airy private balcony, and a sauna-style bathroom with dual vanity, large soaking tub, and rain shower and three shower heads. The stunning chef-approved gourmet kitchen was built, with quartz counter tops, high-end stainless-steel appliances and a walk-in pantry for added storage and efficiency. A distinctive bar adorns the kitchen and makes for a unique space for entertainment and lounging. The main floor allows the flawless welcoming warmth of sunlight through floor to ceiling mitered glass, with an open view of the private courtyard and garden. With efficiency and comfort in mind this home contains custom built-in bookshelves, custom handrails and extra storage space, walk-in closets, high ceilings, recessed lights, and hardwood floors throughout. Third level hosts two rooms that could be used as two bedrooms or opened to use as an over sized bedroom. As an added benefit, enjoy one of the highest rooftop terraces with unobstructed, amazing views for miles around the District, Maryland, and Virginia. Just blocks away from grocery stores, diners, and unique retail shopping; a half mile away from the Metro, Lincoln Park and Barracks Row; a mile away from the H Street Corridor and Union Market there is so much to love about this great neighborhood, and you can enjoy it all from your new home at 242B 14th Street SE!",Active,119 days,Townhouse,$20/month,1900,OLD CITY I,,DCDC2008066,"$989,900",$578,"$1,003,920",Contemporary,38.8858129,-76.9852215,Rory Obletz,Washington Redfin Agent,https://www.redfin.com/DC/Washington/242-14th-St-SE-20003/unit-B/home/145428592,Payne Elementary School,8,346
"70 N St SE #511,","Washington, DC 20003","$449,900",1,1,546,"Fall special: $10,000 towards closing costs for contracts written before 12/15/21 and when using 1 of designated lenders and RGS Title. eNvy is ready to move-in. Enjoy professional baseball and soccer plus the myriad new restaurants and retail moving to this hot, fun area. Retail at street level at eNvy includes: Chicken & Whiskey, Kilwin's confectionary and 99 Taphouse. It's less than 1 block to Metro. Views to Nats Park (and the river) from roof top terrace. Roof-top w/ grills, TVs, lots of seating and resident's lounge. 2-story lobby with library, concierge, waiting lounge and conference table. Pool membership available. Jr. 1BR condo features include: hardwood thru-out, marble & limestone in baths. Kitchens: Bosch appliances, Silestone counters, 42"" gloss white cabinets. Meko shades included.",Active,106 days,Condo,$297/month,2020,OLD CITY I,,DCDC2009914,"$449,900",$824,"$459,756",,38.8747541,-77.0067703,Rory Obletz,Washington Redfin Agent,https://www.redfin.com/DC/Washington/70-N-St-SE-20024/unit-511/home/173632636,"High Road Primary Academy of Washington, Dc",7,-
"630 Browns Ct SE,","Washington, DC 20003","$699,000",2,1.5,700,"NEW IMPROVED PRICE! Like living at the end of a quiet suburban cul-de-dac -- and yet just steps from Eastern Market. This hidden gem is very secluded, tucked away from the busier surrounding streets. Enjoy your morning coffee at the custom granite breakfast counter. Oak hardwoods throughout the first floor give way to stunning Brazilian cherry upstairs. Don't miss the designer bathroom with gorgeous encaustic tile under one of two skylights. A dedicated parking space can be accessed directly from the back door. Separately, the identical unit next door is for sale by the same owner. This is a rare opportunity to buy the entire two-unit building (built in 1991-92). Live in one and rent out the other! Closing help available.",Active,127 days,Townhouse,,1991,CAPITOL HILL,627 Sq. Ft.,DCDC2006926,"$699,000",$999,"$685,355",Traditional,38.8882229,-76.9968365,Rory Obletz,Washington Redfin Agent,https://www.redfin.com/DC/Washington/630-Browns-Ct-SE-20003/home/9899962,Brent Elementary School,8,432
"38 Kings Ct SE,","Washington, DC 20003","$165,000",—,—,756,"Developer/Investor Alert! Prime Capitol Hill alley parcel available in a rapidly developing area of one of the city’s most desirable neighborhoods. Recent zoning changes have permitted the development of alley lots as single-family homes for the first time in a generation, making this an excellent opportunity for the right buyer. Additionally, the existing garage can be a great income source while your design and permits are being finalized or an excellent long-term investment. Walk to Potomac Avenue Metro, Eastern Market/Barracks Row, The Roost by Neighborhood Restaurant Group, Pretzel Bakery, and more! Overall lot dimensions are 21’ wide x 36’ deep, more than double the footprint of the existing garage.",Active,115 days,Vacant Land,,,OLD CITY I,756 Sq. Ft.,DCDC2008294,"$165,000",,"$154,734",,38.8857954,-76.9848215,"Shepherd Homes Group - Jason, Julia, and Judy",Washington Redfin Partner Agent,https://www.redfin.com/DC/Washington/38-Kings-Ct-SE-20003/home/166599024,Payne Elementary School,8,346
"105 6th St SE #202,","Washington, DC 20003","$255,000",—,1,362,"CAPITOL HILL Location! Great walking neighborhood awaits you! Home offers a quiet retreat conveniently located just steps of Capitol Hill, National Mall, Eastern Market, restaurants, shopping and entertainment. This sun-filled home has soaring ceilings and its open floor plan is perfect for daily living. Gorgeous kitchen with granite counters, stainless steel appliances and built-in cabinetry. Updated bathroom. In-unit washer/dryer combo and also offers a free common laundry room to residents . A private serene backyard garden surrounded by trees with a fire pit, picnic table and grill where you can enjoy gatherings with family/friends or quiet time with your pet. Low condo fee of $387/month that includes heat, water, sewer, lawn maintenance, snow removal, management, trash, insurance and laundry.",Active,147 days,Condo,$387/month,1908,CAPITOL HILL,,DCDC2004044,"$255,000",$704,"$250,960",Condo/Unit,38.8883815,-76.9986419,Rory Obletz,Washington Redfin Agent,https://www.redfin.com/DC/Washington/105-6th-St-SE-20003/unit-202/home/12531557,Brent Elementary School,8,432
"218 7th St SE,","Washington, DC 20003","$3,995,000",—,—,—,"LARGE PRICE ADJUSTMENT! Multi- Unit Commercial Building w/ endless possibilities! Convert entire building to residential or keep as income generating mixed-use property! Prime location, Heart of Capitol Hill Historic District, Commercially Zoned 4 level Townhouse across from Historic Eastern Market. Mixed Use-Retail w/ potential to add significant value. Zoned MU-25. * Main Level & 1st Floor: Retail * 2nd Floor: Retail and Office (2 bathrooms) * 3rd Floor: Two (1) Bedroom 1.5 Bath Loft Apartments w/ exterior decks - 1 Vacant, 1 Month-to-Month 2 Parking Spaces in Rear. GBA 9,939SF, (as per DC OTR tax records) Ideal for Non-Profit, Lobbyists, Restaurants, Headquarters Bldg, Law Firm",Active,206 days,Multi-Family (2-4 Unit),,1969,CAPITOL HILL,"2,406 Sq. Ft.",DCDC519746,"$3,995,000",,"$3,481,068",Transitional,38.8867196,-76.9958297,Rory Obletz,Washington Redfin Agent,https://www.redfin.com/DC/Washington/218-7th-St-SE-20003/home/144661473,Brent Elementary School,8,432
"821 Virginia Ave SE,","Washington, DC 20003","$3,500,000",—,—,—,"Rarely available parcel of develop-able land w/ permissive zoning (NC-6). Develop residential or commercial w/ 45' height! • NC-6 Zoning allows for redevelopment into residential/condo/office of 45-foot height. • 6,059 SF Lot, with existing curb cut. • Neighboring Lots have been recently redeveloped into total of 66+ Units. • With FAR of 3.0 allowed under current zoning, possibility of developing 18,000+ SF by right. • Existing Tenant (Dog Daycare) pays $10,000+ per month. • Site is anchored between bustling 8th Street/Barracks Row and the Washington Navy Yard/Baseball Stadium trade area. Eastern Market Metro and Navy Yard Metro Stations within walking distance to subject property, less than 1 Mile. Proximity to 395 Freeway allows for fast accessibility to Virginia, Maryland. US Capitol within walking distance. • 2 buildings currently on Lot, property in Capitol Hill Historic District.",Active,220 days,Multi-Family (2-4 Unit),,1900,OLD CITY I,"6,059 Sq. Ft.",DCDC519254,"$3,500,000",,"$3,151,819",,38.8776911,-76.9940748,Rory Obletz,Washington Redfin Agent,https://www.redfin.com/DC/Washington/821-Virginia-Ave-SE-20003/home/175019380,Tyler Elementary School,7,512
"1107 SE 10th,","Washington, TX 20003","$189,900",—,—,—,Great opportunity for your purchasers/investors seeking land in highly sought after SE Washington DC. This 534 square foot lot is located off of M St. SE and I-695. See PLAT for dimensions. Just a short drive away from the United States Capitol. The Washington Navy yard is 2 blocks away.,Active,589 days,Lots,,,,,66567364,"$189,900",,"$188,826",,38.876891,-76.99288,Christine Armintrout,Washington Redfin Partner Agent,https://www.redfin.com/DC/Washington/1107-10th-St-SE-20003/home/143771065,Van Ness Elementary School,7,270
